date,title,label,object,domain,pmi,score_RISK,week
2025-12-30,"Tok! RI Bakal Impor Gula Industri 3,12 Juta Ton pada 2026",DISCOURSE,General,Trade & Export,3.0,0.0,2025-12-29
2025-04-16,"Aturan Baru Tarif Royalti Nikel-Batu Bara Resmi Terbit, Segini Besarannya",IMPACT,Other Minerals,Mining & Upstream,5.0,0.0,2025-04-14
2025-05-08,Eramet Buka Suara soal Rencana Investasi dengan Danantara di Proyek Nikel,DISCOURSE,Nickel & EV,Industrial & Investment,3.58,0.0,2025-05-05
2025-10-12,Kronologi Kebakaran Menara Scrubber di Pabrik Nikel Kawasan IMIP,DISCOURSE,Nickel & EV,Industrial & Investment,3.0,0.0,2025-10-06
2024-12-31,Kejar Target Investasi Rp13.528 T dengan Hilirisasi dan Kolaborasi,POLICY,Other Minerals,Industrial & Investment,4.38,0.0,2024-12-30
2025-03-20,"Bukan 19 juta, Prabowo Targetkan Buka 8 Juta Lapangan Kerja Dalam 5 Tahun",DISCOURSE,Other Minerals,Industrial & Investment,3.0,0.0,2025-03-17
2026-01-27,"Indika (INDY) Kembali Bentuk Anak Usaha Baru, Perkuat Sektor Penunjang Pertambangan",DISCOURSE,General,Industrial & Investment,3.72,0.0,2026-01-26
2024-11-17,Produsen Alat Berat Pede Target Produksi 8.000 Unit Tercapai pada 2024,DISCOURSE,General,Trade & Export,3.0,0.0,2024-11-11
2025-06-01,"Sebelum Terjadi Tragedi, Aktivitas Tambang Gunung Kuda Cirebon Sudah Diminta Berhenti",EXECUTION,Other Minerals,Mining & Upstream,4.96,0.0,2025-05-26
2024-06-11,"Sejumlah Ormas Keagamaan Tolak Jatah Tambang, Bahlil: Kita Menghargai",DISCOURSE,Coal & Energy,Industrial & Investment,3.0,0.0,2024-06-10
2025-08-15,Prabowo Bakal Kebut Proyek Hilirisasi Senilai Rp618 Triliun,DISCOURSE,Other Minerals,Industrial & Investment,3.0,0.0,2025-08-11
2025-05-14,Penindakan Tegas Aktivitas Tambang Ilegal di Wilayah IUP PTBA,DISCOURSE,Coal & Energy,Sustainability & ESG,3.0,0.0,2025-05-12
2025-10-16,"Waswas Dejavu Booming Nikel, Hilirisasi Bauksit Perlu Strategi Pengendalian",POLICY,Other Minerals,Industrial & Investment,4.66,0.0,2025-10-13
2025-11-05,"Hilirisasi Tembaga Mandek, Ekonom Soroti Arah Peta Jalan hingga Insentif",IMPACT,Other Minerals,Industrial & Investment,4.99,0.0,2025-11-03
2025-12-15,"Potensi Bencana Mengintai, Industri Hotel Jawa Timur Optimistis Okupansi Nataru Tembus 90%",DISCOURSE,General,General,3.89,0.0,2025-12-15
2025-02-26,"Bank Emas Resmi Meluncur, Ekonom: Pengelolaan Emas Bakal Lebih Optimal",DISCOURSE,Other Minerals,Industrial & Investment,3.0,0.0,2025-02-24
2025-02-01,100 Hari Kerja Prabowo-Gibran: Kelanjutan Hilirisasi Masih jadi PR,DISCOURSE,Other Minerals,Industrial & Investment,3.72,0.0,2025-01-27
2025-07-28,Daftar 4 Smelter Nikel Setop Lini Produksi hingga PHK: Ada GNI-Huadi,EXECUTION,Nickel & EV,Industrial & Investment,4.88,0.0,2025-07-28
2025-12-25,Kementerian Ekraf Dorong Kekayaan Intelektual (IP) Sebagai Jaminan Permodalan,DISCOURSE,General,Trade & Export,3.0,0.0,2025-12-22
2025-12-02,PepsiCo Indonesia Perkuat Rantai Pasok Kentang Industri Lokal,DISCOURSE,General,Trade & Export,3.0,0.0,2025-12-01
2025-06-13,"KPK Sebut Izin PT Gag Nikel Raja Ampat Mestinya Ikut Dicabut, Ini Alasannya",EXECUTION,Nickel & EV,Mining & Upstream,5.0,-2.0,2025-06-09
2024-07-26,Manuver Muhammadiyah atas Tawaran Izin Tambang Pemerintah,POLICY,Coal & Energy,Mining & Upstream,4.81,0.0,2024-07-22
2026-01-10,"Trump Ngotot Dorong Agenda Bor Minyak ke Venezuela, Rugikan Produsen AS",EXECUTION,General,Industrial & Investment,4.88,-2.5,2026-01-05
2024-12-12,Menteri Investasi dan DPMPTSP Bidik Investasi Rp13.528 Triliun,POLICY,Other Minerals,Industrial & Investment,4.68,0.0,2024-12-09
2025-09-13,Direktur Chandra Asri Borong 38.500 Saham TPIA,DISCOURSE,General,Industrial & Investment,3.43,0.0,2025-09-08
2025-02-06,"Dipanggil ke Istana, Rosan Lapor ke Prabowo soal Mobil Listrik Buatan Indonesia",DISCOURSE,Nickel & EV,Industrial & Investment,3.0,0.0,2025-02-03
2025-11-21,Pengamat: Hilirisasi Mineral Wujudkan Kemandirian Pertahanan Nasional,DISCOURSE,Nickel & EV,Industrial & Investment,3.0,0.0,2025-11-17
2025-12-18,"Jelang Penerapan Pajak Karbon Manufaktur (CBAM) Eropa, Pemerintah RI Bergeming",DISCOURSE,Other Minerals,Sustainability & ESG,3.0,0.0,2025-12-15
2025-06-01,"Ormas Keagamaan Bisa Kelola Tambang, APWNU Tegaskan Komitmen Legalitas",DISCOURSE,Other Minerals,Mining & Upstream,3.0,0.0,2025-05-26
2025-12-18,Industri Perhotelan Dorong Pemerintah Genjot Belanja Awal 2026,DISCOURSE,General,General,3.24,0.0,2025-12-15
2026-01-01,"Rapor Logam Mulia 2025: Emas Melonjak 63%, Perak Meroket 140%",DISCOURSE,Other Minerals,Trade & Export,3.0,0.0,2025-12-29
2025-09-22,"RI Butuh Investasi Rp371,6 Triliun Buat Hilirisasi Pertanian, Ini Rinciannya!",DISCOURSE,General,Industrial & Investment,3.2,0.0,2025-09-22
2025-01-23,"Deposito Emas Pegadaian, Calon Primadona Pilihan Investasi",DISCOURSE,Other Minerals,Industrial & Investment,3.0,0.0,2025-01-20
2024-12-24,"Kementerian Investasi Susun 3 Kajian Hilirisasi, Ini Detailnya",DISCOURSE,Nickel & EV,Industrial & Investment,3.47,0.0,2024-12-23
2025-04-15,"Buka Peluang Kerja, Pemprov Jakarta dan Lampung Kerja Sama Hilirisasi Pangan",DISCOURSE,General,Industrial & Investment,3.2,0.0,2025-04-14
2026-01-16,Industri Kripto Mulai Siapkan Talenta di Tengah Pengetatan Regulasi,POLICY,General,Mining & Upstream,4.81,0.0,2026-01-12
2024-06-07,Bahlil Tegaskan IUP Tambang Ormas Tidak Dapat Pindah Tangan,POLICY,Coal & Energy,Mining & Upstream,4.27,0.0,2024-06-03
2025-05-08,Industri Hilirisasi Tomat dan Cabai Resmi Beroperasi di Tanah Datar Sumbar,EXECUTION,General,Industrial & Investment,5.0,0.0,2025-05-05
2024-12-17,Muhammadiyah Buka Suara Soal Potensi Kelola Tambang Eks Adaro,DISCOURSE,Other Minerals,Mining & Upstream,3.0,0.0,2024-12-16
2026-01-22,Pemerintah Godok Skema KUR Industri Kreatif Rp10 Triliun,DISCOURSE,General,General,3.0,0.0,2026-01-19
2025-06-10,PT Gag Nikel Siap Ikuti Arahan Pemerintah Terkait Polemik Tambang di Raja Ampat,EXECUTION,Nickel & EV,Mining & Upstream,4.88,0.0,2025-06-09
2025-04-24,Kemlu Bersama Pemprov Bahas Hilirisasi dan Ekspor Kelapa Sawit di Sumbar,DISCOURSE,General,Trade & Export,3.72,0.0,2025-04-21
2026-01-08,Rosan Beberkan Lokasi & Nilai Proyek Hilirisasi yang Groundbreaking Januari 2026,DISCOURSE,Other Minerals,Industrial & Investment,4.27,0.0,2026-01-05
2025-12-17,Terungkap 3 Modus Impor Baja Murah yang Hantam Industri Lokal,DISCOURSE,Other Minerals,Trade & Export,3.0,0.0,2025-12-15
2026-01-12,Ambisi Prabowo Kebut Groundbreaking Proyek Hilirisasi Baru Tahun ini,IMPACT,Other Minerals,Industrial & Investment,5.0,0.0,2026-01-12
2025-08-28,Ekonom: Patriot Bond Bisa Digunakan untuk Hilirisasi serta Program Kerakyatan,IMPACT,General,Industrial & Investment,4.7,0.0,2025-08-25
2025-10-09,"Amran Sebut Ada 1,6 Juta Lapangan Pekerjaan Lewat Hilirisasi Sektor Pertanian",DISCOURSE,General,Trade & Export,3.0,0.0,2025-10-06
2025-02-10,Menteri Rosan: BPI Danantara Segera Diluncurkan,DISCOURSE,General,Industrial & Investment,3.0,0.0,2025-02-10
2025-09-22,Sektor Pertanian Kebagian Rp89 Triliun dari Dana Jumbo Rp200 Triliun Himbara,DISCOURSE,General,Industrial & Investment,3.0,0.0,2025-09-22
2025-12-26,PGJO Dirikan Dua Anak Usaha Baru di Sektor Perdagangan Energi & Logam Nikel,DISCOURSE,Nickel & EV,Industrial & Investment,3.2,0.0,2025-12-22
2025-12-18,"Industri F&B Hadapi Persaingan Ketat, Program Loyalitas Jadi Kunci",DISCOURSE,General,General,3.0,0.0,2025-12-15
2025-03-04,"RI Garap Mandiri Proyek DME Pakai Duit Danantara, Pengamat: Tak Realistis",DISCOURSE,Other Minerals,Industrial & Investment,3.0,0.0,2025-03-03
2025-12-30,"PP Presisi (PPRE) Tutup Tahun dengan Total Kontrak Baru Rp1,2 Triliun",DISCOURSE,Coal & Energy,Industrial & Investment,3.0,0.0,2025-12-29
2025-02-24,"Berau Coal Kantongi IUPK, Izin Tambang Diperpanjang hingga 2035",DISCOURSE,Coal & Energy,Mining & Upstream,3.0,0.0,2025-02-24
2025-11-10,"Swasembada Aluminium, Upaya Berdiri di Kaki Sendiri",EXECUTION,Other Minerals,Industrial & Investment,4.98,0.0,2025-11-10
2025-12-26,Purbaya ungkap Ambisi Besarnya Terkait Geo Dipa dan PT SMI,DISCOURSE,General,General,3.0,0.0,2025-12-22
2025-11-30,"Inalum Torehkan Kinerja Positif Sepanjang 2025, Konsumen Tetap Loyal",DISCOURSE,General,Industrial & Investment,3.0,0.0,2025-11-24
2025-10-28,"STAA Pacu Penghiliran Sawit, Optimistis Cuan Sepanjang 2025",IMPACT,General,Industrial & Investment,4.99,0.0,2025-10-27
2025-03-17,"Emas RI Banyak Dibawa Kabur ke Luar Negeri, Prabowo Bakal Tindak Penambangan Ilegal",EXECUTION,Other Minerals,Industrial & Investment,4.88,0.0,2025-03-17
2025-11-20,Bos Inalum Curhat Butuh Listrik Jumbo PLN untuk Smelter Aluminium di Sumut dan Kalbar,EXECUTION,Coal & Energy,Industrial & Investment,5.0,0.0,2025-11-17
2026-01-10,Penjelasan OJK soal Gugurnya Sejumlah Pinjol pada 2025,DISCOURSE,General,Mining & Upstream,1.04,-3.0,2026-01-05
2026-01-01,"Penyaluran Pembiayaan Kuat, Industri Pergadaian Diproyeksi Positif pada 2026",DISCOURSE,General,General,3.72,0.0,2025-12-29
2025-12-18,Menanti Jalan Tengah Polemik Lahan Tambang,DISCOURSE,Other Minerals,Mining & Upstream,3.0,0.0,2025-12-15
2025-12-16,"Usai Swasembada Beras-Jagung, RI Kejar Hilirisasi Kelapa-Kakao Cs pada 2026",DISCOURSE,General,Industrial & Investment,3.24,0.0,2025-12-15
2026-01-20,Tok! Prabowo Cabut Izin 28 Perusahaan Perusak Lingkungan di Sumatra,DISCOURSE,General,General,3.0,0.0,2026-01-19
2025-11-24,"BRIN Dorong Riset Daerah, Arif Satria: Perlu Percepatan Hilirisasi Inovasi",DISCOURSE,General,Industrial & Investment,3.0,0.0,2025-11-24
2026-01-02,Pengusaha Pede Kawasan Industri Jadi Motor Realisasi Investasi 2026,DISCOURSE,Nickel & EV,Industrial & Investment,3.39,0.0,2025-12-29
2026-01-06,"Buruh Sektor Padat Karya Bebas Pajak di 2026, Begini Respons Pengusaha Alas Kaki",IMPACT,General,Trade & Export,4.11,0.0,2026-01-05
2025-06-18,Harita Nickel (NCKL) Genjot Smelter Baru Produksi Feronikel 60.000 Ton,EXECUTION,Nickel & EV,Industrial & Investment,4.91,0.0,2025-06-16
2026-01-22,"Pemerintah Siapkan Insentif untuk Industri Film hingga Gim, Ini Bocorannya",DISCOURSE,General,Industrial & Investment,3.2,0.0,2026-01-19
2025-11-28,"Permintaan Eskpor Tinggi, Ubi Cilembu Khas Sumedang Perlu Sistem Modern untuk Tingkatkan Kualitas",DISCOURSE,Other Minerals,Trade & Export,3.24,0.0,2025-11-24
2025-10-16,Pengusaha Sebut Pengenaan Pajak Berlapis Hambat Hilirisasi Timah,DISCOURSE,Other Minerals,Industrial & Investment,3.72,0.0,2025-10-13
2026-01-13,"Optimasi Hilirisasi Bauksit Nasional Ciptakan Nilai Tambah US$3,8 Triliun",EXECUTION,Other Minerals,Industrial & Investment,4.88,0.0,2026-01-12
2025-10-20,10 Saham Paling Laris Diserbu Asing Saat Prabowo Dorong Hilirisasi Migas & Komoditas,EXECUTION,Coal & Energy,Industrial & Investment,4.91,0.0,2025-10-20
2026-01-02,BUMA Anak Usaha DOID Tunjuk Ronald Sutardja Jadi Direktur Utama,DISCOURSE,General,General,3.0,0.0,2025-12-29
2026-01-23,Pengamat Ingatkan Purbaya Tak Gegabah Tambah Layer Cukai Rokok,DISCOURSE,General,General,1.04,-3.0,2026-01-19
2025-12-01,"Permintaan Naik, Industri Makanan dan Minuman Pede Tumbuh 6% di 2025",DISCOURSE,General,General,3.0,0.0,2025-12-01
2025-05-07,Pengamat Sarankan Pemerintah Kendalikan Produksi Nikel untuk Jaga Harga,POLICY,Nickel & EV,Mining & Upstream,4.36,0.0,2025-05-05
2025-06-11,Hipmi Minta Kriteria UKM yang Bisa Kelola Tambang Diperketat,DISCOURSE,General,Mining & Upstream,3.72,0.0,2025-06-09
2025-09-28,Smelter Mitra Murni Perkasa Balikpapan Ditargetkan Produksi Penuh pada 2026,EXECUTION,Nickel & EV,Industrial & Investment,5.0,0.0,2025-09-22
2025-11-26,"Biaya Logistik Masih Tinggi, Bisnis Indonesia Forum Dorong Efisiensi Sistem Distribusi",DISCOURSE,General,General,3.24,0.0,2025-11-24
2025-03-25,"Dividen Emiten Nikel, IFSH Tetapkan  Rp13,05 per Saham",POLICY,Nickel & EV,Mining & Upstream,4.38,0.0,2025-03-24
2025-02-19,Titan Infra Sejahtera Berkomitmen Patuhi Regulasi Pertambangan dan Pemberdayaan Masyarakat,IMPACT,Other Minerals,Mining & Upstream,5.0,0.0,2025-02-17
2026-01-11,"Kawasan Industri Lamicitra Kembali Kena Rob, Operasional Tanjung Emas Tetap Jalan",DISCOURSE,Other Minerals,General,3.0,0.0,2026-01-05
2025-09-20,"Prabowo Gelontorkan Rp9,9 Triliun Buat Kopi-Kakao Cs",DISCOURSE,General,Industrial & Investment,4.04,0.0,2025-09-15
2024-07-29,5 Sektor dengan Realisasi Investasi Tertinggi: Industri Logam hingga Pertambangan,DISCOURSE,Coal & Energy,Industrial & Investment,3.0,0.0,2024-07-29
2025-09-23,Bos BYAN Sebut Keekonomian Jadi Kendala Utama Hilirisasi Batu Bara jadi DME,DISCOURSE,Other Minerals,Industrial & Investment,3.36,0.0,2025-09-22
2026-01-22,Realisasi Investasi Jawa Tengah Mulai Bergeser ke Padat Modal,IMPACT,Nickel & EV,Industrial & Investment,4.11,0.0,2026-01-19
2024-10-24,Freeport Masih Finalisasi Pengajuan Perpanjangan Kontrak Selepas 2041,IMPACT,Other Minerals,Mining & Upstream,5.0,0.0,2024-10-21
2025-11-03,"Kinerja Ekspor Sulsel Anjlok 20,41%, Penjualan Komoditas Unggulan Sepi",DISCOURSE,Nickel & EV,Trade & Export,3.0,0.0,2025-11-03
2024-12-28,Riset Binus: Hilirisasi Indonesia Jadi Inspirasi Asia dan Afrika,POLICY,Nickel & EV,Industrial & Investment,1.38,-2.5,2024-12-23
2024-11-20,BKPM Belum Terima Komitmen Apple Investasi US$100 Juta ke Indonesia,DISCOURSE,General,Industrial & Investment,3.92,0.0,2024-11-18
2026-01-06,16 Jenis Kain Tenun Kena Bea Masuk Tambahan Mulai 10 Januari 2026,POLICY,General,Trade & Export,4.91,0.0,2026-01-05
2025-12-09,Mandiri Sekuritas: IHSG Level 9.000 Tinggal Tunggu Waktu,DISCOURSE,Other Minerals,Industrial & Investment,3.24,0.0,2025-12-08
2026-01-21,"DPR Soroti 1 Juta Sarjana Jadi Pengangguran, Menaker Buka Suara",IMPACT,General,General,4.26,0.0,2026-01-19
2026-01-02,"Meredam Stigma Dirty Nickel, Tata Kelola Berkelanjutan jadi Aspek Utama",EXECUTION,Nickel & EV,Sustainability & ESG,5.0,0.0,2025-12-29
2026-01-05,"Pertama dalam 21 Bulan, Ekspor Industri Pengolahan Terkontraksi pada November 2025",DISCOURSE,Other Minerals,Trade & Export,3.0,0.0,2026-01-05
2026-01-21,PHK Massal Pabrik Ban Tak Surutkan China Bangun Pabrik di RI,EXECUTION,General,Industrial & Investment,4.88,0.0,2026-01-19
2025-08-07,"Garut Mau Hilirisasi Jagung, Tapi Pabriknya Masih Impian",DISCOURSE,General,Industrial & Investment,3.0,0.0,2025-08-04
2025-01-02,"Pulang dari China, Rosan Bawa Oleh-oleh Investasi Rp121 Triliun",DISCOURSE,Nickel & EV,Industrial & Investment,3.0,0.0,2024-12-30
2025-12-12,KB Bank dan Intiland Jalin Pembiayaan Pengembangan Kawasan Industri,DISCOURSE,General,General,3.0,0.0,2025-12-08
2025-07-20,"Penjualan Nikel Melonjak, NICL Kemas Omzet Rp1,05 Triliun",EXECUTION,Nickel & EV,Industrial & Investment,4.88,0.0,2025-07-14
2026-01-26,"Harga Emas Tembus Rekor US$5.000, Cek Saham ANTM, BRMS, MDKA Cs",DISCOURSE,Other Minerals,Industrial & Investment,3.24,0.0,2026-01-26
2024-11-10,"Profil Sumber Global Energy (SGER), Emiten yang Dikomplain Perusahaan Vietnam Danka Minerals",DISCOURSE,Coal & Energy,Trade & Export,3.0,0.0,2024-11-04
2025-09-22,BI Dorong Peran Champion Cabai di Jateng untuk Jaga Stabilitas Harga,DISCOURSE,General,Industrial & Investment,3.0,0.0,2025-09-22
2024-11-25,"Bahlil Ungkap Modus 'Dokumen Terbang' Izin Tambang, Pakai Nomor Surat Pengantar Jenazah",DISCOURSE,Other Minerals,Mining & Upstream,3.0,0.0,2024-11-25
2025-04-20,"Bontang Genjot Hilirisasi Perikanan, Fokus Cakalang hingga Tuna",IMPACT,Coal & Energy,Industrial & Investment,4.88,0.0,2025-04-14
2025-06-11,"Izin Tambang Gag Nikel di Raja Ampat Tak Dicabut, Kapan Kembali Beroperasi?",EXECUTION,Nickel & EV,Mining & Upstream,5.0,0.0,2025-06-09
2025-04-23,"Pabrik BYD Diganggu Ormas, BKPM Teriak Menarik Investasi Tak Mudah",DISCOURSE,Nickel & EV,Industrial & Investment,3.0,0.0,2025-04-21
2025-03-18,Ini Alasan Pengusaha Nikel Risau Kenaikan Tarif Royalti Mineral Pertambangan,IMPACT,Nickel & EV,Industrial & Investment,4.89,0.0,2025-03-17
2025-04-22,"Pengusaha Protes Kenaikan Tarif Royalti Bikin Rugi, ESDM Minta Data",IMPACT,Nickel & EV,Mining & Upstream,4.38,0.0,2025-04-21
2026-01-12,"Harga Nikel Rontok, Kepastian Produksi Indonesia Jadi Sorotan",DISCOURSE,Nickel & EV,Trade & Export,3.39,0.0,2026-01-12
2025-12-23,Industri Furnitur Minta Formula UMP 2026 Diterapkan Hati-hati untuk Industri Padat Karya,IMPACT,General,Trade & Export,4.85,0.0,2025-12-22
2025-05-05,"Rencana Hilirisasi PTBA Tak Hanya DME, Mana yang Prioritas?",DISCOURSE,Nickel & EV,Industrial & Investment,3.39,0.0,2025-05-05
2025-10-14,Tok! Kementrian ESDM Terbitkan Izin 16 Blok Tambang Rakyat di NTB,EXECUTION,Other Minerals,Mining & Upstream,5.0,0.0,2025-10-13
2025-11-26,"Pasar EV Terbatas, RI Didorong Genjot Hilirisasi Nikel untuk Produk Ini",IMPACT,Nickel & EV,Industrial & Investment,4.91,0.0,2025-11-24
2024-12-05,"Rosan dan Apple Gelar Pertemuan Malam Ini, Bahas Soal TKDN dan Investasi",DISCOURSE,General,Industrial & Investment,3.2,0.0,2024-12-02
2025-04-15,"Kinerja Solid, Antam Siap Pacu Produksi dan Proyek Hilirisasi",EXECUTION,Nickel & EV,Industrial & Investment,4.88,0.0,2025-04-14
2025-11-24,"Ekspor Bahan Mentah Dilarang, Investasi Hilirisasi Melonjak jadi Rp431,4 Triliun",EXECUTION,Other Minerals,Industrial & Investment,4.88,0.0,2025-11-24
2026-01-12,Proyek DME Batu Bara Bangkit Lagi Usai Mati Suri,EXECUTION,Coal & Energy,Industrial & Investment,5.0,0.0,2026-01-12
2025-11-11,MDKA Ungkap Progres Tambang EMAS & MBMA di Kuartal III/2025,DISCOURSE,Other Minerals,Industrial & Investment,3.43,0.0,2025-11-10
2025-08-15,"Midea Group mulai Bangun Pabrik Baterai di Batam, Bidik Pasar Ekspor",DISCOURSE,Nickel & EV,Industrial & Investment,3.0,0.0,2025-08-11
2025-06-24,Hilirisasi Nikel Jangan Mengabaikan Pelestarian Lingkungan,POLICY,Nickel & EV,Industrial & Investment,4.4,0.0,2025-06-23
2025-06-10,"Bahlil Cabut 4 Izin Tambang di Raja Ampat, Gag Nikel Tak Termasuk",EXECUTION,Nickel & EV,Sustainability & ESG,4.88,0.0,2025-06-09
2026-01-22,"CSIS: Upah Naik tapi Produktivitas Tertahan, Alarm Daya Saing Industri Padat Karya",IMPACT,General,Industrial & Investment,4.85,0.0,2026-01-19
2025-02-19,Bahlil Usul Sebagian Dana Danantara Dipakai untuk Modal Hilirisasi,DISCOURSE,Other Minerals,Industrial & Investment,3.0,0.0,2025-02-17
2025-12-11,"Banjir Kapal Impor, Pengusaha Minta Insentif untuk Genjot Industri Lokal",DISCOURSE,General,Trade & Export,3.2,0.0,2025-12-08
2025-11-24,"Banyak Smelter Beroperasi, Emdeki (MDKI) Bidik Laba Bersih 2025 Tumbuh 25%",DISCOURSE,Nickel & EV,Industrial & Investment,3.47,0.0,2025-11-24
2025-12-08,Jawa Tengah Teguhkan Posisi sebagai Lumbung Pangan Nasional pada 2026,POLICY,General,Industrial & Investment,4.56,0.0,2025-12-08
2025-12-08,"Perbanas: Industri Perbankan Tumbuh Moderat di 2025, Likuiditas dan Permodalan Tetap Kuat",DISCOURSE,General,General,3.0,0.0,2025-12-08
2025-11-13,"Bertemu Rosan, CEO Perusahaan Australia Minat Investasi RS hingga Hilirisasi Nikel",DISCOURSE,Nickel & EV,Industrial & Investment,3.43,0.0,2025-11-10
2025-12-30,Ekonom Ramal Industri Pinjol 2026 Tetap Tumbuh Positif meski Tidak Mulus,DISCOURSE,General,Mining & Upstream,3.92,0.0,2025-12-29
2025-06-09,"Jadi Komisaris PT GAG Nikel, Fahrur Rozi PBNU Bicara Soal Tambang Raja Ampat",EXECUTION,Nickel & EV,Sustainability & ESG,4.88,0.0,2025-06-09
2026-01-13,Permodalan jadi Kendala Industri Penjaminan untuk Berkembang,DISCOURSE,General,Mining & Upstream,3.0,0.0,2026-01-12
2025-10-29,Bos Danantara Libatkan Haji Isam Bahas Hilirisasi Mineral & Investasi,DISCOURSE,Other Minerals,Industrial & Investment,3.0,0.0,2025-10-27
2025-06-10,Kejagung Buka Peluang Usut Polemik Tambang Nikel Raja Ampat,DISCOURSE,Nickel & EV,Mining & Upstream,3.0,0.0,2025-06-09
2026-01-02,Tata Kelola Berkelanjutan Jadi Kunci Hapus Stigma Dirty Nickel Indonesia,EXECUTION,Nickel & EV,Sustainability & ESG,5.0,0.0,2025-12-29
2025-08-24,"Kredit Investasi Bank per Juli 2025 Tumbuh 12,42%, Ditopang Pertambangan & Perkebunan",IMPACT,General,Industrial & Investment,4.26,0.0,2025-08-18
2026-01-26,"Ramalan Cuan Emiten Logam Mulia ANTM, MDKA Cs kala Harga Emas Dunia Memanas",EXECUTION,Other Minerals,Industrial & Investment,4.93,0.0,2026-01-26
2024-12-03,"Sidang Kasus Korupsi Timah, Ahli Nilai UU Tipikor Dipaksakan",DISCOURSE,Other Minerals,Mining & Upstream,1.01,-4.0,2024-12-02
2025-04-23,"Prabowo Panggil Rosan ke Istana, Bahas LG Batal Investasi di RI?",DISCOURSE,Nickel & EV,Industrial & Investment,3.2,0.0,2025-04-21
2026-01-15,Pushep Beberkan Untung Rugi Pemangkasan Produksi Nikel jadi 260 Juta Ton,DISCOURSE,Nickel & EV,Mining & Upstream,4.0,0.0,2026-01-12
2025-04-10,Mahkota Group Sukses Perbaiki Kinerja Bisnis 2024,DISCOURSE,General,Industrial & Investment,3.0,0.0,2025-04-07
2025-12-29,"Kaleidoskop 2025: Semarak Aksi Perbankan, dari IPO hingga Kehadiran Bank Syariah Baru",EXECUTION,General,Mining & Upstream,5.0,0.0,2025-12-29
2026-01-22,"Hilirisasi Kedelai Digencarkan, Garut Siapkan UMKM Masuk Rantai Pasok Program Gizi Nasional",DISCOURSE,General,Industrial & Investment,3.72,0.0,2026-01-19
2025-12-22,Kaleidoskop Minerba 2025: Gaduh Tambang Raja Ampat hingga Insiden Longsor Freeport,DISCOURSE,Nickel & EV,Mining & Upstream,3.0,0.0,2025-12-22
2026-01-22,"Danantara Boyong 3 Proyek Unggulan ini ke WEF Davos, ada Kampung Haji hingga PLTSa",POLICY,Coal & Energy,Industrial & Investment,4.4,0.0,2026-01-19
2025-04-22,Menakar Nasib Megaproyek Baterai RI Usai Ditinggal LG,DISCOURSE,Nickel & EV,Industrial & Investment,4.38,0.0,2025-04-21
2025-11-28,"Prabowo Restui Formula Baru Kenaikan Upah, UMP 2026 Siap Diumumkan?",POLICY,General,General,4.11,0.0,2025-11-24
2025-12-19,"Kejar Ekonomi 8%, Pengusaha Kawasan Industri Gandeng Kemlu Gaet Investor",EXECUTION,General,Industrial & Investment,4.88,0.0,2025-12-15
2024-12-19,"Kaltim Tetapkan UMK dan Upah Sektoral 2025, Berau Tertinggi",POLICY,General,General,4.11,0.0,2024-12-16
2025-07-29,Utak-atik Cari Solusi Bisnis UMKM di Kalimantan Timur,DISCOURSE,General,Trade & Export,1.38,-1.5,2025-07-28
2025-09-28,Kemenkop Dorong Hilirisasi Sawit Lewat Koperasi Sekunder Merah Putih,DISCOURSE,General,Industrial & Investment,3.2,0.0,2025-09-22
2025-12-13,Moderland (MDLN) Pacu Penjualan Rumah & Lahan Industri,DISCOURSE,General,Industrial & Investment,3.43,0.0,2025-12-08
2025-10-23,"Bank Tanah Dukung Hilirisasi Kelapa, Sediakan Lahan 273.000 Ha di Maluku Utara",DISCOURSE,General,Industrial & Investment,3.24,0.0,2025-10-20
2025-09-12,Polemik Lampu Hijau Gag Nikel Kembali Beroperasi Tambang di Raja Ampat,EXECUTION,Nickel & EV,Sustainability & ESG,5.0,0.0,2025-09-08
2025-08-27,BKPM Klaim Kasus Preman Palak Investor Sudah Turun Drastis,DISCOURSE,General,Industrial & Investment,3.0,0.0,2025-08-25
2025-11-16,Indef Ungkap Bukti Pertambangan Dongkrak Ekonomi Daerah,DISCOURSE,Other Minerals,Industrial & Investment,3.24,0.0,2025-11-10
2025-07-29,"Mengintip Data Cadangan Mineral RI Terbaru, Nikel-Tembaga Cs Naik",DISCOURSE,Other Minerals,Mining & Upstream,3.0,0.0,2025-07-28
2025-11-17,Deretan Investasi Baru Rp133 Triliun di IWIP: Ada Baterai hingga Aluminium,IMPACT,Nickel & EV,Industrial & Investment,4.24,0.0,2025-11-17
2025-12-25,"Tantangan Industri Reasuransi pada 2026, Pengamat: Klaim Bencana dan Permodalan",IMPACT,General,General,4.11,0.0,2025-12-22
2026-01-04,Industri Reksa Dana Gantungkan Nasib pada Laju Ekonomi RI 2026,DISCOURSE,General,Industrial & Investment,3.0,0.0,2025-12-29
2025-03-18,Penambang Sebut Tarif Royalti Nikel RI Tertinggi di Dunia,IMPACT,Nickel & EV,Mining & Upstream,5.0,0.0,2025-03-17
2025-05-26,Bos Freeport Pastikan Smelter Baru Produksi 600.000 Ton Katoda Akhir Tahun Ini,EXECUTION,Other Minerals,Industrial & Investment,5.0,0.0,2025-05-26
2025-08-04,"Dukung Hilirisasi Kakao, Bank Tanah Siapkan Lahan 2.700 Ha di Sulteng",DISCOURSE,General,Industrial & Investment,3.39,0.0,2025-08-04
2025-06-09,Polisi Didesak Proses Pidana Perusahaan Tambang Nikel di Raja Ampat,EXECUTION,General,Sustainability & ESG,5.0,0.0,2025-06-09
2025-08-26,"Kementan Dukung Hilirisasi Kelapa, 3 Pabrik Kelapa Bakal Dibangun di Riau",DISCOURSE,General,Industrial & Investment,3.0,0.0,2025-08-25
2025-12-04,Resep Sukses JNE Bertahan 35 Tahun di Tengah Persaingan Industri Logistik RI,DISCOURSE,General,Industrial & Investment,3.0,0.0,2025-12-01
2024-11-19,Perhapi Berharap Ditjen Gakkum Mampu Berantas Tambang Ilegal,POLICY,General,Mining & Upstream,1.0,-15.0,2024-11-18
2025-09-03,PREMIUM NOTES: Kartu Kuat Emiten Toto Sugiri (DCII) hingga Perusahaan Pertambangan Boy Thohir,DISCOURSE,General,Industrial & Investment,3.24,0.0,2025-09-01
2024-11-11,Merdeka Copper Gold (MDKA) Umumkan Kinerja Kuartal III/2024,EXECUTION,Nickel & EV,Industrial & Investment,5.0,0.0,2024-11-11
2025-12-02,Emira E. Oepangat Resmi jadi Direktur Eksekutif AAJI Gantikan Togar Pasaribu,DISCOURSE,General,General,3.0,0.0,2025-12-01
2025-11-24,"Penyimpanan Limbah Tailing Nyaris Penuh, Pabrik Nikel di IMIP Kurangi Produksi",EXECUTION,Nickel & EV,Industrial & Investment,4.9,0.0,2025-11-24
2024-11-18,Kredit Bank ke Sektor Tambang Tumbuh Tinggi per Semester I/2024,DISCOURSE,Coal & Energy,Sustainability & ESG,3.1,0.0,2024-11-18
2025-10-28,BKPM: Hilirisasi Jadi Kunci Turunkan Harga Energi Hijau di RI,IMPACT,Coal & Energy,Industrial & Investment,4.11,0.0,2025-10-27
2025-12-08,"Premi Industri Asuransi Jiwa Capai Rp133 Triliun per September 2025, Ini Data Lengkapnya",DISCOURSE,General,Industrial & Investment,3.0,0.0,2025-12-08
2025-12-17,Kaleidoskop 2025: Mengenang Para Miliarder yang Meninggal Dunia di 2025,DISCOURSE,Coal & Energy,Industrial & Investment,3.0,0.0,2025-12-15
2025-08-27,Bos Freeport Janji Perbaikan Smelter PT Smelting Rampung 7 September 2025,IMPACT,Other Minerals,Industrial & Investment,4.11,0.0,2025-08-25
2025-08-16,"Prabowo Kebut Proyek Hilirisasi Rp618 Triliun, Ekonom Kritisi Efek Nilai Tambah",DISCOURSE,Other Minerals,Industrial & Investment,3.0,0.0,2025-08-11
2024-12-03,Tok! Harga Ekspor Konsentrat Tembaga & Timbal Turun Desember 2024,DISCOURSE,Other Minerals,Trade & Export,3.0,0.0,2024-12-02
2026-01-02,Menatap Prospek 2026: Emiten Grup MIND ID Cetak Performa Impresif,DISCOURSE,Nickel & EV,Industrial & Investment,3.1,0.0,2025-12-29
2024-12-14,United Tractors (UNTR) Bidik Target Lebih Tinggi pada 2025,DISCOURSE,General,General,3.24,0.0,2024-12-09
