date,title,label,object,domain,pmi,score_RISK,week
2025-04-21,Mentan Amran Ingin Sumbawa Jadi Sentra Hilirisasi Jagung,IMPACT,General,Industrial & Investment,4.11,0.0,2025-04-21
2025-11-28,Kemarahan Sjafrie dan Krisis Kendali di Morowali,EXECUTION,Nickel & EV,Industrial & Investment,5.0,0.0,2025-11-24
2026-01-09,"Cegah Banjir Bandang, Andra Soni Siapkan Moratorium Tambang di Banten",DISCOURSE,General,Mining & Upstream,1.0,-9.0,2026-01-05
2025-06-12,"Usai Cekcok dengan Istri, Humas Perusahaan Tambang Nikel di Konawe Ditemukan Tewas Gantung Diri",DISCOURSE,Nickel & EV,General,3.0,0.0,2025-06-09
2025-12-06,Satgas PKH: Bandara PT IWIP Belum Penuhi Standar Minimal Perangkat Negara,EXECUTION,Nickel & EV,General,4.88,0.0,2025-12-01
2024-05-26,Bos Freeport Indonesia Cek Kesiapan Smelter Gresik Jelang Beroperasi,EXECUTION,Other Minerals,Industrial & Investment,5.0,0.0,2024-05-20
2024-08-16,Jokowi Sebut Selama 8 Tahun Smelter Nikel Cs Hasilkan Rp 158 Triliun,DISCOURSE,Other Minerals,Industrial & Investment,3.0,0.0,2024-08-12
2025-07-18,"Negosiasi dengan AS Masih Berlangsung, Pemerintah Upayakan CPO hingga Nikel Dapat Tarif 0 Persen",DISCOURSE,Nickel & EV,Trade & Export,3.0,0.0,2025-07-14
2025-12-24,Purbaya Siapkan Kredit Rp 2 T Buat Industri Tekstil hingga Furnitur,DISCOURSE,General,Trade & Export,3.0,0.0,2025-12-22
2026-01-12,Prabowo Bahas Ekosistem Semikonduktor buat Dukung Industri Otomotif,DISCOURSE,Other Minerals,Industrial & Investment,3.24,0.0,2026-01-12
2025-07-09,"Indonesia Sumbang 4,12 Persen Bahan Baku Minyak Atsiri Dunia, Kapan Hilirisasinya?",DISCOURSE,General,Industrial & Investment,3.24,0.0,2025-07-07
2026-01-19,"PMI-BI Naik Tipis, Aktivitas Industri Pengolahan Bergeliat",DISCOURSE,General,Industrial & Investment,3.0,0.0,2026-01-19
2026-01-15,Prabowo Ingin Pemanfaatan Mineral Kritis Dipercepat,DISCOURSE,Other Minerals,Industrial & Investment,3.0,0.0,2026-01-12
2025-09-30,"Dari Film Sore ke Sorowako, Menelisik Komitmen Industri Wujudkan Praktik Tambang Berkelanjutan",DISCOURSE,Nickel & EV,Sustainability & ESG,3.24,0.0,2025-09-29
2025-06-12,Uskup Timika: Sebaiknya Tambang Nikel di Pulau Gag Juga Ditutup,EXECUTION,Nickel & EV,Mining & Upstream,5.0,0.0,2025-06-09
2025-05-22,Kejagung Masih Hitung Nilai Aset Rest Area Bos Smelter Timah yang Disita,EXECUTION,Other Minerals,Industrial & Investment,1.0,-8.0,2025-05-19
2025-06-12,"Demo Tolak Tambang Nikel di Raja Ampat, Satu Anggota LBH Papua dan Satu Peserta Aksi di Jayapura Ditangkap Polisi",DISCOURSE,Nickel & EV,Mining & Upstream,3.0,0.0,2025-06-09
2024-10-10,"Sandra Dewi Klaim 88 Tas yang Disita Kejaksaan Hasil ""Endorse"", Bukan Dibelikan Harvey Moeis",DISCOURSE,Other Minerals,General,1.19,-2.0,2024-10-07
2026-01-15,IWIP Jadi Percontohan Kawasan Industri Nikel Berkelanjutan,DISCOURSE,Nickel & EV,Sustainability & ESG,3.24,0.0,2026-01-12
2025-06-09,Sederet Pelanggaran 4 Perusahaan Tambang Nikel di Raja Ampat,EXECUTION,Nickel & EV,Sustainability & ESG,3.15,-2.5,2025-06-09
2025-09-23,Anggota DPR Soroti Penjualan Ilegal Bijih dari PT Timah: Smelter Swasta Berani Bayar Lebih Mahal,DISCOURSE,Other Minerals,Mining & Upstream,3.0,0.0,2025-09-22
2025-07-16,Gibran: Kemenyan Sama Berharganya dengan Nikel,DISCOURSE,Nickel & EV,Industrial & Investment,3.0,0.0,2025-07-14
2025-08-22,PTBA dan UGM Hadirkan Produk Kalium Humat dari Hilirisasi Batu Bara untuk Suburkan Tanah,DISCOURSE,Coal & Energy,Industrial & Investment,3.0,0.0,2025-08-18
2025-10-28,Mendorong Nilai Tambah di Negeri Seribu Kelapa,DISCOURSE,Other Minerals,Industrial & Investment,3.0,0.0,2025-10-27
2025-05-20,"Industri Nikel Dorong Standar Global, Ini Manfaatnya untuk Hilirisasi",DISCOURSE,Other Minerals,Industrial & Investment,3.0,0.0,2025-05-19
2026-01-23,"Sorot Pajak Tambang Tak Kembali ke Daerah Asal, Dedi Mulyadi: Rumah Kumuh, Pendidikan Tertinggal...",DISCOURSE,General,Sustainability & ESG,3.2,0.0,2026-01-19
2025-11-06,Mengapa Hilirisasi Tembaga dan Emas Perlu?,DISCOURSE,Other Minerals,Industrial & Investment,3.24,0.0,2025-11-03
2025-08-22,Siapa Rudy Ong? Bos Tambang yang Dijemput Paksa KPK Terkait Kasus IUP di Kaltim,EXECUTION,Coal & Energy,Mining & Upstream,1.01,-8.0,2025-08-18
2025-06-10,"4 Izin Usaha Tambang di Raja Ampat Dicabut, PT Gag Tak Termasuk",EXECUTION,Nickel & EV,Mining & Upstream,4.88,0.0,2025-06-09
2026-01-14,Bauksit hingga Bioavtur Masuk Daftar Groundbreaking Proyek Hilirisasi Danantara,DISCOURSE,Other Minerals,Industrial & Investment,3.0,0.0,2026-01-12
2025-12-10,"Smelter Gresik Sementara Berhenti Operasi, Bos Freeport Jamin Tak Ada PHK Karyawan",IMPACT,Other Minerals,Industrial & Investment,5.0,0.0,2025-12-08
2025-06-24,KPK Koordinasi dengan Greenpeace Bahas IUP Nikel di Raja Ampat,DISCOURSE,Nickel & EV,Mining & Upstream,1.0,-12.0,2025-06-23
2026-01-05,Nasib Minyak Venezuela Setelah Penangkapan Presiden Maduro,EXECUTION,Other Minerals,Industrial & Investment,4.85,-2.5,2026-01-05
2025-06-11,Pemilik Kapal JKW dan Iriana Bantah Terlibat Angkut Nikel Raja Ampat,DISCOURSE,Nickel & EV,Industrial & Investment,3.0,0.0,2025-06-09
2024-11-29,Proyek Smelter Grup MIND ID Serap 8.600 Tenaga Kerja,IMPACT,Other Minerals,Industrial & Investment,5.0,0.0,2024-11-25
2025-06-12,"Ahmad Fahrur Rozi Jadi Komisaris PT Gag Nikel, PBNU: Itu Urusan Pribadi",EXECUTION,Nickel & EV,Mining & Upstream,5.0,0.0,2025-06-09
2025-10-14,"Dedi Mulyadi Tegaskan Nasib Tambang Rumpin dan Cigudeg Berdasarkan Audit Ilmiah, Bukan Tekanan Politik",DISCOURSE,Coal & Energy,Sustainability & ESG,3.0,0.0,2025-10-13
2024-10-10,Sandra Dewi Mengaku Akan Larang Harvey Moeis jika Tahu Bisnis dengan BUMN,EXECUTION,Other Minerals,Industrial & Investment,3.49,-2.0,2024-10-07
2025-06-20,"Kirim Surat Terbuka ke Presiden Prabowo, Masyarakat Suku Kawei Minta Pencabutan IUP PT KSM Ditinjau Ulang",EXECUTION,Coal & Energy,Sustainability & ESG,5.0,0.0,2025-06-16
2025-05-20,Bahlil Sebut Sejumlah Proyek Hilirisasi Ini Akan Diresmikan Prabowo,EXECUTION,Nickel & EV,Industrial & Investment,5.0,0.0,2025-05-19
2025-06-20,Wamen ESDM Beri Sinyal PT Gag Nikel Bakal Beroperasi Kembali,EXECUTION,Nickel & EV,Mining & Upstream,5.0,0.0,2025-06-16
2025-07-16,"BKPM Targetkan Investasi Hilirisasi Rp 521,4 Triliun Sepanjang 2025",POLICY,Other Minerals,Industrial & Investment,4.38,0.0,2025-07-14
2025-06-02,Pengamat: RI Sulit Tarik Investasi jika Masih Ada Hambatan Ormas dan Kebijakan,DISCOURSE,Other Minerals,Industrial & Investment,3.0,0.0,2025-06-02
2025-01-03,"Utamakan Keselamatan, Begini Prosedur Pengolahan Nikel di Kawasan IMIP",EXECUTION,Nickel & EV,Industrial & Investment,4.88,0.0,2024-12-30
2026-01-19,Prilly Latuconsina Umumkan Mundur dari Rumah Produksi Sinemaku Pictures,DISCOURSE,General,General,3.0,0.0,2026-01-19
2025-06-11,KKP Usulkan Revisi Aturan Izin Pulau Kecil Usai Kasus Tambang Nikel di Raja Ampat,DISCOURSE,Nickel & EV,Industrial & Investment,3.0,0.0,2025-06-09
2025-07-29,"Manis di Podium, Pahit di Lahan: Tebu Dalam Bayang-bayang Retorika Hilirisasi",DISCOURSE,Nickel & EV,Industrial & Investment,3.34,0.0,2025-07-28
2025-06-10,"Komisi XII Sebut PT Gag Nikel Punya Legalitas Kuat, Wajar Izin Tambang Tak Dicabut",DISCOURSE,Nickel & EV,Mining & Upstream,3.88,0.0,2025-06-09
2025-07-25,Kejati Bengkulu Pamerkan Barang Mewah Hasil Sitaan Tersangka Korupsi Pertambangan,POLICY,Coal & Energy,Mining & Upstream,1.59,-2.0,2025-07-21
2025-11-06,"Rapat Bareng Airlangga-Bahlil, Prabowo Perintahkan Percepat Hilirisasi",EXECUTION,Other Minerals,Industrial & Investment,4.88,0.0,2025-11-03
2026-01-18,"Kejar Pertumbuhan 5,51 Persen, 1.236 Perusahaan Industri Siap Produksi",IMPACT,General,Industrial & Investment,4.99,0.0,2026-01-12
2025-06-11,Anggota DPR Dorong Investigasi Pemberi Izin Tambang di Raja Ampat,EXECUTION,Nickel & EV,Mining & Upstream,4.88,0.0,2025-06-09
2025-10-11,"Malaysia Siapkan APBN Rp 1.838 Triliun, Terbesar dalam Sejarah, Pajak Diperketat",DISCOURSE,Other Minerals,Trade & Export,3.65,0.0,2025-10-06
2024-04-27,5 Smelter Terkait Kasus Korupsi Timah yang Disita Kejagung Akan Tetap Beroperasi,EXECUTION,Other Minerals,Industrial & Investment,1.03,-8.0,2024-04-22
2025-05-08,"Filipina Bakal Larang Ekspor Nikel, Industri Smelter RI Terancam",DISCOURSE,Nickel & EV,Industrial & Investment,1.28,-2.0,2025-05-05
2025-06-10,"UMKM Bakal Kelola Tambang, Menteri Maman: PP-nya Segera Rampung",POLICY,Coal & Energy,Industrial & Investment,4.27,0.0,2025-06-09
2026-01-27,6 Alasan Kasus Pajak Cha Eun Woo Disebut Salah Satu yang Paling Serius di Industri Hiburan Korea,DISCOURSE,General,General,3.0,0.0,2026-01-26
2025-10-27,"Mentan Amran Lepas Ekspor Produk Kelapa Malut ke Tiongkok, Bukti Keberhasilan Hilirisasi Daerah",DISCOURSE,General,Trade & Export,3.0,0.0,2025-10-27
2024-09-25,"Pegawai Smelter Swasta Transfer 7,5 M ke Money Changer Helena Lim Atas Perintah Atasan",DISCOURSE,Other Minerals,Industrial & Investment,1.01,-4.0,2024-09-23
2025-11-27,"Tak Hanya EV, Sektor Metalurgi Hijau Bisa Dongkrak Hilirisasi Nikel",IMPACT,Nickel & EV,Industrial & Investment,4.91,0.0,2025-11-24
2024-10-23,Harvey Moeis Sebut Gubernur dan Kapolda Babel Pimpin Rapat PT Timah dengan Smelter Swasta pada 2018,DISCOURSE,Other Minerals,Industrial & Investment,1.19,-2.0,2024-10-21
2025-03-17,"Prabowo Tinjau Produksi Logam Mulia di Smelter Freeport, Sebut Pencapaian Terbesar",EXECUTION,Other Minerals,Industrial & Investment,4.88,0.0,2025-03-17
2025-12-28,"Kasus Izin Tambang Konawe Utara Disetop Sejak 2024, KPK: Terkendala Hitung Kerugian Negara",POLICY,Nickel & EV,General,1.59,-2.0,2025-12-22
2025-07-11,Bisnis Domestik dan Ekspor Kacang Mete,DISCOURSE,General,Trade & Export,3.0,0.0,2025-07-07
2025-06-17,Negara-negara G7 Diminta Perkuat Rencana Mineral Kritis Berkelanjutan,DISCOURSE,Nickel & EV,Sustainability & ESG,3.2,0.0,2025-06-16
2025-11-17,"Prabowo Bertemu Dasco di Istana, Bahas Olahraga, Hilirisasi hingga Situasi Politik",DISCOURSE,General,Industrial & Investment,3.2,0.0,2025-11-17
2025-09-14,Menteri LH Tetapkan Batasan Ketat untuk PT Gag Nikel di Raja Ampat,EXECUTION,Nickel & EV,Sustainability & ESG,4.96,-2.5,2025-09-08
2025-10-20,"3 Jurusan Pertambangan di PTN, Biaya UKT di Bawah Rp 10 Juta",DISCOURSE,General,General,3.0,0.0,2025-10-20
2025-08-25,Momen Rudy Ong Chandra Ngomel Sendiri Saat Ditampilkan KPK dalam Kasus Suap IUP Kaltim,POLICY,General,Mining & Upstream,1.0,-6.5,2025-08-25
2026-01-19,Sidang Korupsi Batu Bara Bengkulu: Saksi Ungkap Manipulasi Data PT Sucofindo,DISCOURSE,General,Mining & Upstream,1.0,-8.0,2026-01-19
2024-05-14,"Bangun Smelter, Tahun Ini ADMR Alokasikan Capex hingga 250 Juta Dollar AS",DISCOURSE,Other Minerals,Industrial & Investment,3.39,0.0,2024-05-13
2026-01-07,"Skor ESG Naik, Pertamina Pimpin Industri Migas Terintegrasi Global",DISCOURSE,Coal & Energy,Sustainability & ESG,3.0,0.0,2026-01-05
2026-01-24,"Korea Selatan Resmi Berlakukan UU AI, Industri Antara Cemas dan Antusias",POLICY,General,General,2.46,-2.5,2026-01-19
2025-09-23,"Hilirisasi Perkebunan Didukung 29 Provinsi, Target 1,6 Juta Lapangan Kerja",DISCOURSE,General,Industrial & Investment,3.0,0.0,2025-09-22
2024-03-21,Polisi Gerebek Rumah yang Dijadikan Smelter Pasir Timah di Belitung,DISCOURSE,Other Minerals,Industrial & Investment,3.0,0.0,2024-03-18
2025-06-09,"Pertambangan di Raja Ampat, Pemerintah Didesak Cabut Izin Perusahaan yang Melanggar",EXECUTION,Nickel & EV,Mining & Upstream,4.88,0.0,2025-06-09
2025-06-11,"Usai Viral, Pemilik Beberkan Alasan JKW dan Iriana Jadi Nama Kapal",DISCOURSE,Nickel & EV,General,3.0,0.0,2025-06-09
2025-06-07,"Polemik Tambang Nikel di Raja Ampat, Apa Saja Diketahui Sejauh Ini?",DISCOURSE,Nickel & EV,Mining & Upstream,3.2,0.0,2025-06-02
2024-05-06,PGN Suplai Gas Bumi untuk Smelter Tembaga Freeport,EXECUTION,Other Minerals,Industrial & Investment,5.0,0.0,2024-05-06
2026-01-09,"Daya Beli Melemah, Industri Hotel dan Restoran Bandung Barat Tertekan Sepanjang 2025",EXECUTION,General,General,4.88,0.0,2026-01-05
2026-01-15,"Kasus Izin Tambang di Konawe Utara: Disetop KPK, Didalami Kejagung",DISCOURSE,General,Mining & Upstream,1.19,-2.0,2026-01-12
2024-10-02,Bos Smelter Jelaskan soal Kerja Sama dengan PT Timah hingga Setoran ke Harvey Moeis,DISCOURSE,Other Minerals,Industrial & Investment,1.01,-4.0,2024-09-30
2024-10-02,"Sekretaris Bos Smelter Timah Disebut Transaksi Valas Ratusan Kali, Totalnya Capai Rp 80 M",DISCOURSE,Other Minerals,Industrial & Investment,1.19,-2.0,2024-09-30
2025-12-31,Polri Tetapkan 2 Eks Pejabat Kementerian ESDM Jadi Tersangka Korupsi Penerangan Jalan,POLICY,Other Minerals,Mining & Upstream,1.01,-6.0,2025-12-29
2026-01-17,DPR Sebut Kebangkitan BUMN Tekstil Penting bagi Industri Nasional,DISCOURSE,General,Trade & Export,3.58,0.0,2026-01-12
2026-01-17,"Polisi dan TNI Gerebek Tambang Batu Ilegal di Desa Sungai Pinang Riau, 2 Pelaku Ditangkap",DISCOURSE,General,Mining & Upstream,3.0,0.0,2026-01-12
2025-12-20,"Pasokan Dinilai Berlebih, Produksi Nikel dan Batu Bara 2026 Dipangkas",DISCOURSE,Nickel & EV,Mining & Upstream,3.2,0.0,2025-12-15
2024-02-14,Bahlil Minta Perbankan Biayai Pengusaha untuk Bangun Smelter,DISCOURSE,Nickel & EV,Industrial & Investment,3.0,0.0,2024-02-12
2025-12-27,"Inovasi Vaksin dan Obat Kanker, Etana Raih Penghargaan Kemenkes",DISCOURSE,General,General,3.72,0.0,2025-12-22
2025-06-10,Depinas SOKSI Dukung Langkah Pemerintah Hentikan Aktivitas Tambang Nikel di Raja Ampat,DISCOURSE,Nickel & EV,Mining & Upstream,3.72,0.0,2025-06-09
2026-01-10,"Pembiayaan Modal Ventura Tembus Rp 16,29 Triliun, Ini Sektor Terbesarnya",DISCOURSE,General,Industrial & Investment,3.0,0.0,2026-01-05
2026-01-23,Hino Motors: Pabrikan Truk dengan TKDN Tertinggi di Indonesia,DISCOURSE,General,Industrial & Investment,3.0,0.0,2026-01-19
2025-04-30,"7 Proyek Smelter Bauksit Mangkrak, Mayoritas Terkendala Dana",EXECUTION,Other Minerals,Industrial & Investment,1.38,-5.5,2025-04-28
2025-12-29,"Bencana Demografi di Indonesia Makin Nyata, Kalah dari Negara Tetangga",DISCOURSE,General,General,3.0,0.0,2025-12-29
2025-12-24,"Kawasan Industri Besar Dibangun di Indramayu, DPRD Ingatkan untuk Prioritaskan Tenaga Kerja Lokal",DISCOURSE,General,Sustainability & ESG,3.2,0.0,2025-12-22
2024-09-24,Jokowi Resmikan Injeksi Bauksit Perdana Smelter Grade Alumina Refinery di Mempawah,DISCOURSE,Other Minerals,Industrial & Investment,3.0,0.0,2024-09-23
2026-01-06,Pasar Privat Jadi Mesin Uang Baru Industri Manajemen Aset Global,DISCOURSE,General,Industrial & Investment,3.69,0.0,2026-01-05
2026-01-23,Mitsubishi Fuso Cemas Truk Ilegal China Mengancam Industri Nasional,EXECUTION,General,Sustainability & ESG,5.0,0.0,2026-01-19
2025-08-21,Anggota DPR Wanti-wanti Legalisasi Tambang Ilegal: Mafia Bisa Ganti Baju,DISCOURSE,Coal & Energy,Mining & Upstream,3.3,0.0,2025-08-18
2025-03-17,"Di Gresik, Prabowo Resmikan Smelter Emas Freeport",DISCOURSE,Other Minerals,Industrial & Investment,3.0,0.0,2025-03-17
2026-01-23,"Dilirik untuk Etanol, Industri Pati Ubi Kayu Digenjot",DISCOURSE,General,Trade & Export,3.0,0.0,2026-01-19
2025-08-05,Mengapa Gibran dan Luhut Giat Mendorong Hilirisasi Kemenyan?,DISCOURSE,Nickel & EV,Industrial & Investment,3.0,0.0,2025-08-04
2025-06-10,Bahlil Bantah Baru Cabut 4 Izin Usaha Tambang di Raja Ampat karena Viral,POLICY,Nickel & EV,Mining & Upstream,4.27,0.0,2025-06-09
2026-01-05,"Trump Siap Hidupkan Industri Minyak Venezuela, Butuh Biaya Rp 1.674 Triliun",DISCOURSE,Coal & Energy,Industrial & Investment,1.56,-2.0,2026-01-05
2026-01-21,Ahmad Yani Ditunjuk Jadi Dirut Pertamina Geothermal Energy (PGEO),DISCOURSE,Coal & Energy,General,3.24,0.0,2026-01-19
2026-01-06,Aismoli Targetkan 75.000 Unit Motor Listrik pada 2026,DISCOURSE,Coal & Energy,Industrial & Investment,3.24,0.0,2026-01-05
2025-10-15,Energi Bersih: Mimpi Besar atau Janji Kosong Indonesia?,DISCOURSE,Nickel & EV,Sustainability & ESG,1.73,-1.5,2025-10-13
2026-01-15,"Dorong Ekspor Petrokimia, KB Bank Biayai Pengembangan Kapasitas Petro Oxo Nusantara",DISCOURSE,Coal & Energy,Trade & Export,3.0,0.0,2026-01-12
2025-04-30,"Smelter “Merah Putih” Beroperasi, Ceria Group Perkuat Hilirisasi Nikel",DISCOURSE,Nickel & EV,Industrial & Investment,3.24,0.0,2025-04-28
2025-09-25,Fitomining: Cara Baru Tambang Nikel dari Tanaman,IMPACT,Nickel & EV,Sustainability & ESG,4.92,0.0,2025-09-22
2025-12-19,"Nusron Klaim Tak Terbitkan Izin HGU Sawit dan Tambang 1,67 Hektar Selama Menjabat",DISCOURSE,General,General,3.0,0.0,2025-12-15
2025-10-11,"Tambang Grasberg Terhenti, Smelter Freeport di Gresik Ikut Mandek",EXECUTION,Other Minerals,Mining & Upstream,5.0,0.0,2025-10-06
2025-10-18,"Pengusaha Hibahkan Lahan, Pemkab Bogor Percepat Pembangunan Jalan Khusus di Area Pertambangan",DISCOURSE,General,General,3.39,0.0,2025-10-13
2026-01-21,"Diajukan Maret 2025, Sumbar Punya Wilayah Pertambangan Rakyat 301 Blok",POLICY,Other Minerals,Mining & Upstream,4.11,0.0,2026-01-19
2025-04-30,"Gibran Soal Hilirisasi: Laut Kita Tak Hanya Kaya, Tapi Penopang Kehidupan",DISCOURSE,General,Industrial & Investment,3.0,0.0,2025-04-28
2025-03-17,"Jokowi Diundang Prabowo Hadiri Peresmian Smelter Freeport, tetapi Tak Datang",EXECUTION,Other Minerals,Industrial & Investment,4.81,0.0,2025-03-17
2025-05-22,Bahlil Pastikan Smelter Freeport Mulai Beroperasi Juni 2025,EXECUTION,Other Minerals,Industrial & Investment,1.15,-4.5,2025-05-19
2025-06-10,"Penjelasan Bahlil soal Izin Tambang PT Gag Nikel Tidak Dicabut, tapi Diawasi Ketat",EXECUTION,Nickel & EV,Mining & Upstream,5.0,-2.5,2025-06-09
2025-08-18,"Ledakan Sumur Minyak Ungkap Aktivitas Ilegal di Blora, Polisi Siapkan Operasi Penertiban",EXECUTION,General,Mining & Upstream,5.0,0.0,2025-08-18
2025-07-10,"Cara Menperin Genjot Hilirisasi, Usai Investasi di Sektor Industri Capai Rp136,6 Triliun",DISCOURSE,General,Industrial & Investment,3.0,0.0,2025-07-07
2026-01-23,"Tindak Lanjuti Temuan BPK, Pemprov Kaltim Perketat Pengawasan Perusahaan Tambang",EXECUTION,Other Minerals,Mining & Upstream,5.0,0.0,2026-01-19
2023-12-28,"Tungku Smelter Meledak, Kemenperin Pelototi Implementasi K3 Perusahaan",DISCOURSE,Nickel & EV,Industrial & Investment,3.0,0.0,2023-12-25
2025-12-11,"Aparat Gabungan Segel Tambang Emas Ilegal di Mamuju, Lokasi Terus Dipantau",DISCOURSE,Other Minerals,Sustainability & ESG,3.0,0.0,2025-12-08
2025-06-11,PKS Dorong Evaluasi Izin Tambang di Wilayah Konservasi Lain,DISCOURSE,Nickel & EV,Mining & Upstream,3.0,0.0,2025-06-09
2025-12-22,"KEK Industropolis Batang Serap Investasi Rp 4,87 Triliun pada 2025",EXECUTION,Nickel & EV,Industrial & Investment,4.94,0.0,2025-12-22
2024-10-15,"Smelter Gresik Terbakar, Freeport Lakukan Asesmen dan Evaluasi Penyebab Utama Kebakaran",DISCOURSE,General,Industrial & Investment,3.0,0.0,2024-10-14
2026-01-17,Daftar Lima Negara Investor Terbesar di Indonesia pada 2025,DISCOURSE,Other Minerals,Industrial & Investment,3.0,0.0,2026-01-12
2025-05-22,"Kejagung Sita ""Rest Area"" di Tol Jagorawi Milik Bos Smelter Timah",POLICY,Other Minerals,Mining & Upstream,1.0,-10.0,2025-05-19
2024-09-30,"Harvey Moeis Telepon Bos Smelter Swasta, Undang Rapat di Restoran",DISCOURSE,Other Minerals,Industrial & Investment,1.0,-6.0,2024-09-30
2024-05-02,"Berikan Pelatihan Keuangan untuk UMKM Lokal, PT GNI Bantu Perkuat Ekonomi di Morowali Utara",DISCOURSE,Nickel & EV,General,3.0,0.0,2024-04-29
2025-07-14,"Pertambangan Liar di Kalteng Bisa Dilegalkan, Bagaimana Ketentuannya?",DISCOURSE,Other Minerals,Mining & Upstream,3.0,0.0,2025-07-14
2025-09-19,Dari Hilirisasi ke Reindustrialisasi,DISCOURSE,Nickel & EV,Industrial & Investment,3.1,0.0,2025-09-15
2024-06-27,Smelter Terbesar di Dunia Freeport Indonesia di Gresik Resmi Beroperasi,EXECUTION,Other Minerals,Industrial & Investment,5.0,0.0,2024-06-24
2025-06-13,"Nama Kapal Mirip Inisialnya, Jokowi: Alhamdulillah, Punya Kapal",DISCOURSE,Nickel & EV,Sustainability & ESG,1.09,-2.5,2025-06-09
2025-06-13,Greenpeace Desak Pemerintah Cabut Izin Tambang PT Gag Nikel di Raja Ampat,POLICY,Nickel & EV,General,4.11,0.0,2025-06-09
2026-01-21,Menperin Harap DPR Segera Sahkan RUU Kawasan Industri,IMPACT,General,Industrial & Investment,4.11,0.0,2026-01-19
2026-01-19,"Setelah 3 Abad Eksploitasi Timah, Pemprov Babel Ajukan Ranperda Tambang",DISCOURSE,Other Minerals,Sustainability & ESG,3.0,0.0,2026-01-19
2025-08-13,Pengamat: Kita Bicara Hilirisasi tetapi Food Tray Saja Kok Impor…,IMPACT,General,Trade & Export,4.18,0.0,2025-08-11
2024-09-18,PT Timah Masih Lebur Lagi Logam dari Smelter Swasta padahal Sudah Bayar Biaya Sewa,DISCOURSE,Other Minerals,Industrial & Investment,1.23,-2.0,2024-09-16
2026-01-02,Eks Dewas Sebut KPK Terlambat Laporkan SP3 Kasus Tambang Nikel Konawe Utara,DISCOURSE,Nickel & EV,General,1.0,-6.0,2025-12-29
2024-01-02,"Ledakan Tungku Smelter Morowali, Jumlah Korban Jadi 20 Orang, Polisi Kantongi Nama Tersangka",POLICY,Nickel & EV,Industrial & Investment,4.7,0.0,2024-01-01
2025-07-29,"Korupsi Tambang, Kejati Bengkulu Segel Stockpile Batubara dan Alat Berat 2 Perusahaan",POLICY,Coal & Energy,General,1.03,-4.0,2025-07-28
2025-08-18,"Target Investasi Rp 2.175 Triliun di 2026, Pemerintah Hadapi PR Berat",DISCOURSE,General,Industrial & Investment,3.92,0.0,2025-08-18
2024-01-13,"Peringati BK3N 2024 di Smelter Freeport Gresik, Menaker Ida Tekankan Pentingnya K3 di Tempat Kerja",EXECUTION,Other Minerals,Industrial & Investment,4.88,0.0,2024-01-08
2026-01-08,Krakatau Steel (KRAS) Pasok Pipa Baja Proyek Pipanisasi Dumai–Sei Mangkei,DISCOURSE,General,Industrial & Investment,3.2,0.0,2026-01-05
2026-01-24,"Harga Nikel Tertekan, INCO Andalkan Strategi Keberlanjutan",EXECUTION,Nickel & EV,Sustainability & ESG,4.88,0.0,2026-01-19
2026-01-15,"Buktikan Keseriusan, Kia Indonesia Bidik Penjualan Hingga 40.000 Unit",DISCOURSE,Nickel & EV,Industrial & Investment,3.47,0.0,2026-01-12
2026-01-08,"2 IPO Lighthouse Mengintip Pasar di 2026, dari Nikel dan Infrastruktur",DISCOURSE,Nickel & EV,Industrial & Investment,3.24,0.0,2026-01-05
2025-06-14,"Berwisata ke Raja Ampat di Tengah Polemik Tambang Nikel, Amankah?",DISCOURSE,Nickel & EV,Mining & Upstream,3.0,0.0,2025-06-09
2024-07-31,Jaksa Ungkap Modus 5 Perusahaan Smelter Lakukan Penambangan Ilegal di Wilayah IUP PT Timah,DISCOURSE,Other Minerals,Mining & Upstream,1.0,-6.0,2024-07-29
2026-01-20,Perusahaan Tambang Nikel Ini Rehabilitasi 743 Hektare Hutan di Konawe,DISCOURSE,Nickel & EV,Sustainability & ESG,3.72,0.0,2026-01-19
2024-11-01,"Bos Smelter Ungkap Ada Perusahaan Boneka ""Titipan"" PT Timah",DISCOURSE,Other Minerals,Industrial & Investment,1.19,-2.0,2024-10-28
2025-06-10,"DPR Sebut Penghentian Sementara Aktivitas PT Gag Nikel Sudah Tepat, Mengapa?",EXECUTION,Nickel & EV,Mining & Upstream,4.88,0.0,2025-06-09
2023-12-28,"Usai Operasi Kepala, Korban Ledakan Smelter Morowali Dirawat di Palopo Jalani Operasi Leher",DISCOURSE,Nickel & EV,Industrial & Investment,3.0,0.0,2023-12-25
2026-01-09,"Buruh Terpaksa Libur, Gaji Dipotong Akibat Banjir di Lamicitra Pelabuhan Semarang",EXECUTION,Other Minerals,General,4.88,0.0,2026-01-05
2025-09-11,"Bank Mandiri Kucurkan Kredit Rp 35,75 Triliun untuk Hilirisasi Mineral",DISCOURSE,Other Minerals,Industrial & Investment,3.0,0.0,2025-09-08
2025-11-25,"Ekspor Produk Hasil Hutan Stagnan, Kemenhut Genjot Hilirisasi",DISCOURSE,General,Trade & Export,3.72,0.0,2025-11-24
2025-12-24,"Rumah Bahagia Samboja, Cara Industri Migas Ikut Tekan Stunting",DISCOURSE,Coal & Energy,General,3.0,0.0,2025-12-22
2025-11-30,Mentan Amran Dorong Hilirisasi Gambir dengan Nilai Potensi Rp 500 Triliun,DISCOURSE,Other Minerals,Industrial & Investment,3.2,0.0,2025-11-24
2024-09-25,Bahlil Minta Smelter Pakai Energi Baru Terbarukan,IMPACT,Nickel & EV,Industrial & Investment,4.11,0.0,2024-09-23
2025-06-16,"Kasus Penambangan Liar di Kalteng Marak, Pemerintah Buka Wilayah Tambang Rakyat",DISCOURSE,Other Minerals,Mining & Upstream,3.0,0.0,2025-06-16
2025-09-18,"Kecil tapi Vital, Kenali Fungsi Busi, Jenis, dan Materialnya",DISCOURSE,Nickel & EV,General,3.0,0.0,2025-09-15
2025-10-09,Mentan Bakal Setop Ekspor Kelapa Gelondongan ke Luar Negeri,DISCOURSE,General,Trade & Export,3.39,0.0,2025-10-06
2026-01-21,"Eks Bupati Konawe Utara Masih Berstatus Saksi, Belum Dicegah ke Luar Negeri",DISCOURSE,General,General,1.01,-4.0,2026-01-19
2024-10-15,"Smelter Freeport di Gresik Terbakar, Manajemen Lakukan Investigasi",DISCOURSE,General,Industrial & Investment,1.19,-2.0,2024-10-14
2024-11-13,"Auditor BPKP Sebut Tanpa Sewa Smelter PT Timah, Perusahaan Swasta Tak Bisa Beroperasi",EXECUTION,Other Minerals,Industrial & Investment,1.02,-6.0,2024-11-11
2025-12-30,"Menperin Surati Menkeu Purbaya, Usulkan Insentif Industri Otomotif",DISCOURSE,Nickel & EV,Trade & Export,1.19,-2.0,2025-12-29
2025-07-31,Apakah Dollar Bisa Jadi Rp 1.000 Lewat Hilirisasi? Ini Kata Ekonom,DISCOURSE,General,Industrial & Investment,3.0,0.0,2025-07-28
2023-12-28,Pemerintah Diminta Bentuk Satgas Keselamatan Kerja di Seluruh Smelter,DISCOURSE,Nickel & EV,Industrial & Investment,3.0,0.0,2023-12-25
2025-06-12,"Pemerintah Tak Cabut IUP PT GAG Nikel, Uskup Timika: Tandanya Belum Tulus dan Legawa",EXECUTION,Nickel & EV,Mining & Upstream,5.0,0.0,2025-06-09
2025-06-16,Pertambangan Nikel di Raja Ampat Termasuk 22 Kasus Ekosob yang Melanggar HAM di Papua,DISCOURSE,Nickel & EV,Industrial & Investment,3.0,0.0,2025-06-16
2024-09-23,Jokowi Resmikan Smelter Tembaga dan Pemurnian Logam Mulia Senilai Rp 21 Triliun di NTB,DISCOURSE,Other Minerals,Industrial & Investment,3.2,0.0,2024-09-23
2026-01-02,China Dorong Mobil Daur Ulang,DISCOURSE,Nickel & EV,Industrial & Investment,4.2,0.0,2025-12-29
2025-07-01,"Transisi Energi Indonesia: Hijau dalam Narasi, Abu-abu dalam Praktik",DISCOURSE,Nickel & EV,Industrial & Investment,3.0,0.0,2025-06-30
2025-12-27,AS Ungkap Dugaan Praktik Curang Industri Chip China,DISCOURSE,General,Trade & Export,3.83,0.0,2025-12-22
2026-01-09,Toyota Nilai Insentif Sekali Pakai Tak Bisa Dongkrak Industri Otomotif,DISCOURSE,General,General,3.0,0.0,2026-01-05
2025-11-18,"Kalteng Alami Kekurangan Tenaga Kerja untuk Topang Kegiatan Industri, Hambat Upaya Hilirisasi",IMPACT,Coal & Energy,Industrial & Investment,2.08,-1.5,2025-11-17
