date,title,label,object,domain,pmi,score_RISK,week
2025-11-27,"Pengusaha Minta Insentif Ekspor Kelapa, Bukan Pembatasan",DISCOURSE,General,Trade & Export,3.0,0.0,2025-11-24
2025-12-31,"Kepri Jadi Lokomotif Ekonomi Sumatra, Tumbuh 7,48% hingga Kuartal III/2025",EXECUTION,Coal & Energy,Industrial & Investment,4.88,0.0,2025-12-29
2025-05-05,Manufaktur dan Pertanian Masih jadi Penopang Pertumbuhan Ekonomi Kuartal I/2025,DISCOURSE,Other Minerals,Trade & Export,3.2,0.0,2025-05-05
2024-10-13,Bahlil Pastikan PP Persis Dapat Jatah Tambang: Lagi Proses,DISCOURSE,Other Minerals,Mining & Upstream,3.0,0.0,2024-10-07
2025-05-27,"RI Masif Bangun PLTS, Hilirisasi Pasir Kuarsa Diharapkan Bakal Terpacu",DISCOURSE,Other Minerals,Mining & Upstream,3.58,0.0,2025-05-26
2025-08-26,"Eramet Bantah Akuisisi Smelter Huayou, Tapi Peluang Tetap Terbuka",DISCOURSE,Nickel & EV,Industrial & Investment,3.67,0.0,2025-08-25
2026-01-13,Prabowo Bakal Guyur Rp101 Triliun untuk Selamatkan Industri Tekstil,DISCOURSE,General,Trade & Export,3.2,0.0,2026-01-12
2026-01-23,Core: Struktur Upah Dorong Pergeseran Basis Industri Padat Karya,EXECUTION,Coal & Energy,Industrial & Investment,5.0,0.0,2026-01-19
2025-03-05,"DME Batu Bara Jadi Proyek Terbesar RI, Investasi Tembus Rp180,36 Triliun",DISCOURSE,Other Minerals,Industrial & Investment,3.2,0.0,2025-03-03
2025-06-03,"Ekspor Sulsel Turun 4,84% pada April 2025, Nikel Biang Keroknya",DISCOURSE,Nickel & EV,Trade & Export,3.0,0.0,2025-06-02
2025-07-22,"Danantara Kaji 18 Proyek Hilirisasi Rp618,13 Triliun, Pengamat Ingatkan Hal Ini",DISCOURSE,Nickel & EV,Industrial & Investment,3.0,0.0,2025-07-21
2024-12-20,"Kepemimpinan Berdampak, Dirut MIND ID Kembali Dapat Penghargaan",DISCOURSE,Other Minerals,Industrial & Investment,3.0,0.0,2024-12-16
2025-09-09,"Kadin Bakal Perkuat Bisnis dengan Chile, Ini Potensinya",DISCOURSE,Other Minerals,Industrial & Investment,3.24,0.0,2025-09-08
2025-02-25,ESDM Ungkap Potensi 35 Proyek Hilirisasi Didanai Danantara,DISCOURSE,Other Minerals,Mining & Upstream,3.0,0.0,2025-02-24
2024-10-28,"BPK Temukan 4 Pertambangan Nikel Tanpa Izin, ESDM Janji Tindak Tegas",DISCOURSE,Nickel & EV,Mining & Upstream,1.0,-7.5,2024-10-28
2025-12-19,Kaleidoskop 2025: Manufaktur Didera Gangguan Premanisme hingga Pasokan Gas,EXECUTION,Nickel & EV,Industrial & Investment,4.91,0.0,2025-12-15
2024-11-16,Ini Alasan Indosat (ISAT) Mau Bangun AI Center di Jayapura,DISCOURSE,General,General,3.2,0.0,2024-11-11
2026-01-14,Prospek Industri Pinjol P2P di Tengah Maraknya Gagal Bayar dan Penyusutan Pemain,POLICY,General,Mining & Upstream,4.8,0.0,2026-01-12
2026-01-23,"Truk Impor China Ancam Industri Lokal, Isuzu Bilang Begini",DISCOURSE,General,Trade & Export,3.72,0.0,2026-01-19
2025-06-15,Kemenhut Awasi Ketat Pemegang Izin Penggunaan Kawasan Hutan,DISCOURSE,Nickel & EV,Mining & Upstream,1.09,-2.5,2025-06-09
2024-12-12,"BKPM Fasilitasi Kemitraan Usaha Besar dan UMKM Rp15,9 Triliun selama 2022-2024",DISCOURSE,Other Minerals,Industrial & Investment,3.0,0.0,2024-12-09
2025-04-30,"Kuartal I/2025, Vale (INCO) Kantongi Lonjakan Laba Saat Harga Nikel Melandai",DISCOURSE,Nickel & EV,Mining & Upstream,3.2,0.0,2025-04-28
2025-08-10,Analis: Rebalancing Indeks MSCI Cerminkan Rotasi di Sektor Energi dan Pertambangan,DISCOURSE,General,Mining & Upstream,3.0,0.0,2025-08-04
2026-01-14,ESDM Patok Kuota Produksi Nikel Sekitar 260 Juta Ton pada 2026,DISCOURSE,Nickel & EV,Mining & Upstream,3.0,0.0,2026-01-12
2025-11-28,Inovasi dari Sektor Industri Dukung Pencapaian Second NDC Indonesia,EXECUTION,General,Sustainability & ESG,5.0,0.0,2025-11-24
2025-12-22,Pengusaha Tekstil Kalang Kabut Formulasi Upah 2026 Diubah: Pabrik Bisa Bangkrut,POLICY,General,Industrial & Investment,2.99,-1.5,2025-12-22
2025-08-25,"Hubungan Bilateral RI-China Masuk Umur 75 Tahun, Kerja Sama Saling Menguntungkan",EXECUTION,Nickel & EV,Industrial & Investment,4.81,0.0,2025-08-25
2025-04-14,Wamen Investasi Pede Relaksasi TKDN Tak Bikin Investor di RI Kabur,POLICY,General,Industrial & Investment,4.56,0.0,2025-04-14
2026-01-21,Obligasi untuk Biayai Dekarbonisasi Industri Diramal Menggeliat pada 2026,DISCOURSE,Coal & Energy,Sustainability & ESG,3.24,0.0,2026-01-19
2024-07-10,Komitmen Amman Mineral Kembangkan Potensi Ekonomi Daerah,EXECUTION,Other Minerals,Industrial & Investment,4.9,0.0,2024-07-08
2025-10-25,Trump Cabut Kebijakan Batas Emisi Smelter Tembaga Era Joe Biden,POLICY,Other Minerals,Industrial & Investment,4.52,0.0,2025-10-20
2025-12-01,Jababeka (KIJA) Ramal Investor China dan Asia Timur Masih Mendominasi pada 2026,DISCOURSE,General,Industrial & Investment,3.24,0.0,2025-12-01
2025-04-17,MIND ID & Arab Saudi Jajaki Peluang Kerja Sama Hilirisasi,DISCOURSE,Other Minerals,Industrial & Investment,3.0,0.0,2025-04-14
2025-12-29,"Radiant Ruby Tuntaskan Akuisisi 51% Saham AMMS, Intip Tujuannya",EXECUTION,General,Industrial & Investment,4.94,0.0,2025-12-29
2025-12-08,BI Sebut Ekonomi Kaltim Akan terus Tumbuh Masif pada 2027,IMPACT,General,Industrial & Investment,4.99,0.0,2025-12-08
2025-02-14,RI Tawarkan 35 Proyek Hilirisasi ke Investor Senilai Rp2.015 Triliun,DISCOURSE,Other Minerals,Industrial & Investment,3.0,0.0,2025-02-10
2026-01-24,Fuso: Truk Ilegal China dan Harga CPO jadi Pukulan Telak Pasar Kendaraan Niaga,EXECUTION,General,Trade & Export,4.97,0.0,2026-01-19
2024-09-25,Entitas Usaha DOID Raih Perpanjangan Kontrak Rp2 Triliun di Australia,DISCOURSE,Coal & Energy,Industrial & Investment,3.2,0.0,2024-09-23
2025-12-19,"Industri Garmen Pemalang Kembali Beroperasi, Pulihkan Lapangan Kerja",IMPACT,General,Industrial & Investment,4.99,0.0,2025-12-15
2025-11-05,"Sektor Tambang Kuartal III/2025 Terpuruk, Batu Bara Kontraksi Paling Dalam",DISCOURSE,General,General,3.0,0.0,2025-11-03
2025-11-06,"Panggil Airlangga hingga Purbaya, Prabowo Instruksikan Percepat Hilirisasi",DISCOURSE,Other Minerals,Industrial & Investment,3.0,0.0,2025-11-03
2025-06-11,Bareskrim Ikut Selidiki Polemik Tambang Nikel di Raja Ampat,EXECUTION,Nickel & EV,Mining & Upstream,4.93,-2.0,2025-06-09
2025-12-05,"Indef: 76% Impor Bahan Baku Sulit Diganti, RI Perlu Reformasi Industri Hulu",DISCOURSE,Nickel & EV,Trade & Export,3.0,0.0,2025-12-01
2025-02-28,"Penjualan Bijih Nikel United Tractors (UNTR) 2024 Capai 1,97 Juta wmt",DISCOURSE,Nickel & EV,General,3.0,0.0,2025-02-24
2025-11-11,"Potensi Laut Melimpah, tapi Mengapa Hilirisasi Perikanan Kepri Masih Rendah?",DISCOURSE,Coal & Energy,Industrial & Investment,3.72,0.0,2025-11-10
2026-01-23,"Alasan Indonesia Masih Impor Daging Sapi, Ini Perbandingan Kualitasnya",DISCOURSE,General,Trade & Export,3.0,0.0,2026-01-19
2025-12-17,Formula UMP 2026 Memberatkan Dunia Usaha? Ini Kata Menaker,DISCOURSE,General,General,3.0,0.0,2025-12-15
2026-01-10,"Glencore Divestasi Saham Harita Nickel (NCKL) Senilai Rp276,9 Miliar",IMPACT,Nickel & EV,Industrial & Investment,4.24,0.0,2026-01-05
2025-12-31,Pengamat: Potensi Besar Perikanan RI Dinikmati Negara Lain,DISCOURSE,General,Trade & Export,4.23,0.0,2025-12-29
2026-01-07,Industri Hotel Babak Belur: Gulung Tikar hingga PHK Massal,DISCOURSE,General,General,3.16,0.0,2026-01-05
2024-06-10,Vale (INCO) Pastikan Tak Ada Penciutan Lahan dalam Kontrak Tambang Baru,DISCOURSE,Nickel & EV,Mining & Upstream,3.0,0.0,2024-06-10
2025-10-20,PTBA Siapkan 120 Juta Ton Batu Bara untuk Proyek Hilirisasi DME,EXECUTION,Coal & Energy,Industrial & Investment,4.88,0.0,2025-10-20
2025-12-23,Kementerian ESDM Tegaskan Tidak Ada Aktivitas Pertambangan di Gunung Slamet,DISCOURSE,Other Minerals,Mining & Upstream,3.0,0.0,2025-12-22
2025-06-06,Backbone Transmisi untuk Industri Smelter Nikel di Kaltim Resmi Beroperasi,DISCOURSE,Coal & Energy,Industrial & Investment,3.0,0.0,2025-06-02
2025-11-04,Adira Finance (ADMF) Catat Pembiayaan Alat Berat Rp374 Miliar meski Ekspor Batu Bara Turun,DISCOURSE,Other Minerals,Trade & Export,3.0,0.0,2025-11-03
2025-12-13,Hilirisasi Jadi Strategi Mengejar Target Pertumbuhan Ekonomi 8%,DISCOURSE,Other Minerals,Industrial & Investment,3.0,0.0,2025-12-08
2025-01-31,"Realisasi Investasi 2024 Rp1.714,2 Triliun Lampaui Target, Seperempatnya dari Hilirisasi",DISCOURSE,Other Minerals,Industrial & Investment,3.43,0.0,2025-01-27
2025-05-11,"Filipina Berencana Larang Ekspor Nikel Mulai Juni, Apa Dampak Bagi RI?",DISCOURSE,Nickel & EV,Trade & Export,3.2,0.0,2025-05-05
2024-12-30,Penelitian Universitas Brawijaya: Program Kemitraan Positif Dukung Hilirisasi,EXECUTION,Other Minerals,Industrial & Investment,4.88,0.0,2024-12-30
2025-07-04,"Pengusaha Tambang Tolak Wacana Penerbitan RKAB Setahun Sekali, Hambat Investasi",IMPACT,Nickel & EV,Mining & Upstream,4.76,0.0,2025-06-30
2025-12-02,"Menteri Rosan Targetkan Pabrik Hilirisasi Kelapa Rp1,66 triliun Rampung 2026",IMPACT,General,Industrial & Investment,4.59,0.0,2025-12-01
2024-10-10,Bahlil Minta Pengusaha Tak Zalimi Masyarakat di Sekitar Tambang,DISCOURSE,Other Minerals,Mining & Upstream,3.0,0.0,2024-10-07
2025-03-19,PLN Pastikan SUTT 150 kV Kolonodale - Tentena di Sulteng Beroperasi Akhir Maret 2025,EXECUTION,Coal & Energy,Industrial & Investment,5.0,0.0,2025-03-17
2024-06-13,"Kontrak Vale (INCO) Diperpanjang hingga 2035, Proyek Nikel Rp138 Triliun Dikebut",EXECUTION,Other Minerals,Mining & Upstream,4.88,0.0,2024-06-10
2024-07-29,"Vale Indonesia (INCO) Cetak Laba Bersih Rp611,26 Miliar Semester I/2024",DISCOURSE,Nickel & EV,Industrial & Investment,3.0,0.0,2024-07-29
2025-11-22,Pabrik Sawit Raksasa RI-Korsel AGPA Refinery Complex Beroperasi di Balikpapan,EXECUTION,General,Sustainability & ESG,4.99,0.0,2025-11-17
2025-03-26,"KITB Bertransformasi Jadi KEK Industropolis Batang, Dukung Industrialisasi dan Hilirisasi",IMPACT,General,Industrial & Investment,5.0,0.0,2025-03-24
2025-07-30,"Pukulan Ganda Industri Batu Bara: Ekspor Anjlok, Permintaan Smelter Redup",IMPACT,Coal & Energy,Industrial & Investment,4.99,0.0,2025-07-28
2025-11-11,"Stok Nikel Menumpuk, Pengamat: Relaksasi Ekspor Terbatas Bisa Jadi Opsi",EXECUTION,Nickel & EV,Trade & Export,4.88,0.0,2025-11-10
2026-01-21,Kadin Sarankan BUMN Tekstil Baru Fokus Produksi Benang hingga Serat,DISCOURSE,Coal & Energy,Trade & Export,3.39,0.0,2026-01-19
2025-06-11,Prospek Investasi Nikel Usai Pemerintah Cabut 4 Izin Tambang Raja Ampat,EXECUTION,Nickel & EV,Sustainability & ESG,3.49,-2.5,2025-06-09
2026-01-04,OJK Optimistis Portofolio UMKM Industri Penjaminan Tembus 90% pada 2028,DISCOURSE,General,Mining & Upstream,3.0,0.0,2025-12-29
2025-03-14,"Rosan Roeslani Beberkan Sektor Penopang Investasi, Danantara Siap Terlibat?",DISCOURSE,Other Minerals,Industrial & Investment,3.47,0.0,2025-03-10
2025-11-09,"Usai Kasus Timah, Prabowo Kini Pelototi Tambang Nikel Ilegal Morowali",DISCOURSE,Nickel & EV,General,3.0,0.0,2025-11-03
2025-12-24,Uni Eropa akan Perketat Impor Plastik demi Bantu Industri Daur Ulang,DISCOURSE,General,Trade & Export,4.04,0.0,2025-12-22
2025-11-04,"Dunia Terancam Krisis Tembaga di 2028, RI Mesti Kebut Hilirisasi",IMPACT,Other Minerals,Trade & Export,4.88,0.0,2025-11-03
2026-01-19,"Survei BI: Aktivitas Usaha Kuartal IV/2025 Melambat, Pertanian Cs Jadi Pemberat",DISCOURSE,General,General,3.24,0.0,2026-01-19
2025-07-29,"Investasi Hilirisasi Capai Rp280,8 Triliun Semester I/2025, Nikel Jadi Primadona",DISCOURSE,Other Minerals,Industrial & Investment,4.27,0.0,2025-07-28
2025-12-23,"Imbas Bencana Sumatra, AAUI Nilai Industri Reasuransi Perlu Terus Diperkuat",IMPACT,General,General,4.85,0.0,2025-12-22
2025-08-12,Saham PP Presisi (PPRE) Sentuh ARA Usai Kontrak Baru Tumbuh 60%,DISCOURSE,General,Industrial & Investment,3.0,0.0,2025-08-11
2025-04-30,Strategi Indonesia Jaga Kerja Sama dengan China Di Tengah Gempuran Tarif Trump,DISCOURSE,General,Trade & Export,3.0,0.0,2025-04-28
2025-08-29,Bahlil Sebut Freeport Belum Ajukan Perpanjangan Izin Ekspor Konsentrat Tembaga,EXECUTION,Other Minerals,Industrial & Investment,4.9,0.0,2025-08-25
2025-04-12,Pengusaha Nikel Protes Rencana Kenaikan Royalti saat Harga Komoditas Jatuh,IMPACT,Nickel & EV,Mining & Upstream,4.97,0.0,2025-04-07
2026-01-08,"Harga Nikel Mendingin Lagi, RI Belum Kasih Kepastian Soal Produksi",DISCOURSE,Nickel & EV,Trade & Export,3.39,0.0,2026-01-05
2026-01-24,Jateng Perkuat Kerja Sama Ketenagakerjaan dengan Jepang,DISCOURSE,Coal & Energy,Industrial & Investment,3.0,0.0,2026-01-19
2025-11-18,Blenyik dari Jepara: Dari Dapur Rumahan ke Harapan Baru Ekonomi Pesisir,DISCOURSE,General,Industrial & Investment,3.0,0.0,2025-11-17
2025-01-14,"Smelter Mangkrak Hambat Hilirisasi Bauksit, Celios Usul Solusi Ini",EXECUTION,Other Minerals,Industrial & Investment,1.01,-6.5,2025-01-13
2025-12-16,MEBI Sampaikan Empat Rekomendasi Percepat Pemanfaatan Biomassa Nasional,DISCOURSE,Coal & Energy,Sustainability & ESG,3.39,0.0,2025-12-15
2025-09-29,"Indonesia Lokasi Favorit Manufaktur Hijau China, Apa Strategi Pemerintah?",DISCOURSE,Nickel & EV,Industrial & Investment,3.2,0.0,2025-09-29
2026-01-06,Techno9 (NINE) Beberkan Rencana Akuisisi Aset Tambang Poh Group di Mongolia,DISCOURSE,Other Minerals,Industrial & Investment,3.62,0.0,2026-01-05
2024-05-30,"Grup Astra UNTR Cuan Bisnis Nikel Stargate, Diversifikasi Batu Bara",DISCOURSE,Nickel & EV,Industrial & Investment,3.24,0.0,2024-05-27
2025-11-28,Transcoal Pacific (TCPI) Genjot Diversifikasi Pengangkutan Bijih Nikel,DISCOURSE,Nickel & EV,Sustainability & ESG,3.0,0.0,2025-11-24
2025-01-11,Bahlil Bakal Wajibkan Perbankan dan LK Non-Bank Danai Proyek Hilirisasi,DISCOURSE,Nickel & EV,Industrial & Investment,3.2,0.0,2025-01-06
2026-01-14,Sugiono Beberkan Strategi Kemenlu Gaet Investasi Global di Kawasan Industri RI,DISCOURSE,Nickel & EV,Industrial & Investment,3.0,0.0,2026-01-12
2025-09-08,"Chile Incar Peluang Dagang Lebih Besar di RI, Prioritas Tambang dan Pangan",DISCOURSE,Other Minerals,Trade & Export,3.0,0.0,2025-09-08
2024-06-05,KPK Wanti-wanti Jokowi Soal Izin Ormas Kelola Tambang,DISCOURSE,Coal & Energy,Mining & Upstream,1.0,-6.0,2024-06-03
2025-10-07,Pelimpahan Aset Smelter & Alat Berat Kerek Harga Saham Timah (TINS),DISCOURSE,Other Minerals,Industrial & Investment,1.29,-2.0,2025-10-06
2025-07-23,RI Bakal Buka Keran Ekspor Nikel Cs ke AS? Ini Kata ESDM,DISCOURSE,Other Minerals,Trade & Export,3.0,0.0,2025-07-21
2025-12-02,Industri Sawit Wajib Lindungi Pekerja Perempuan dan Bebas Pekerja Anak,POLICY,Other Minerals,Trade & Export,4.24,0.0,2025-12-01
2025-12-30,"Pesawat Terbatas, Kinerja Industri Penerbangan Masih Lesu Sepanjang 2025",DISCOURSE,General,General,3.0,0.0,2025-12-29
2025-06-10,"Gasifikasi Batu Bara Menjadi DME, Pekerjaan Rumah PTBA yang Tertunda",IMPACT,Other Minerals,Industrial & Investment,4.99,0.0,2025-06-09
2025-04-24,Ternyata Ini Alasan LG Batal Investasi di Proyek Baterai Nikel: Diperlakukan Beda,DISCOURSE,Nickel & EV,Industrial & Investment,3.2,0.0,2025-04-21
2025-12-10,"Harga Emas Dunia Hari Ini Naik jelang Keputusan Bunga The Fed, Perak Cetak Rekor",DISCOURSE,Other Minerals,General,3.0,0.0,2025-12-08
2024-08-31,Ini 4 Isu Prioritas yang Bakal Dibahas di Indonesia-Africa Forum (IAF) Ke-2 di Bali,DISCOURSE,Other Minerals,Sustainability & ESG,3.69,0.0,2024-08-26
2026-01-27,"Pasar Industri Cukup Tinggi, Produk BBM B40 Performance Masuk Sumbagsel",POLICY,Coal & Energy,General,4.11,0.0,2026-01-26
2024-11-15,Bumi Resources (BUMI) Kerja Sama Hilirisasi Batu Bara dengan Perusahaan China,DISCOURSE,General,Industrial & Investment,3.0,0.0,2024-11-11
2025-02-05,Polisi Perketat Pengawasan Aktivitas Pertambangan di Gunung Galunggung,EXECUTION,Other Minerals,Sustainability & ESG,5.0,0.0,2025-02-03
2025-06-11,KKP Kaji Aturan Izin Pulau Kecil Imbas Kisruh Tambang Raja Ampat,POLICY,Nickel & EV,Sustainability & ESG,4.48,0.0,2025-06-09
2025-09-22,Indef Sebut Perluasan Hilirisasi jadi Kunci Dongkrak Kontribusi Manufaktur ke PDB,DISCOURSE,General,Industrial & Investment,3.2,0.0,2025-09-22
2025-05-27,"Soal Perpanjangan IUPK, Bos Freeport: Fokus Penyelesaian Smelter Gresik Dulu",IMPACT,Other Minerals,Industrial & Investment,5.0,0.0,2025-05-26
2025-10-11,Melihat Bingkai Praktik ESG dalam Industri Nikel Morowali,EXECUTION,Nickel & EV,Sustainability & ESG,4.88,0.0,2025-10-06
2025-04-28,"Saratoga (SRTG) Serok 71,56 Juta Saham Adaro Andalan (AADI)",DISCOURSE,General,Industrial & Investment,3.0,0.0,2025-04-28
2025-12-09,Garut Didorong Kembangkan Potensi Domba Hingga Industri Ekraf,DISCOURSE,General,General,3.2,0.0,2025-12-08
2025-11-06,Indef Dorong Pemerintah Tinjau Ulang Arah Kebijakan Hilirisasi Mineral,DISCOURSE,Nickel & EV,Industrial & Investment,3.0,0.0,2025-11-03
2025-05-17,Prospek Penghiliran Nikel Hadapi Modal Tinggi,IMPACT,Nickel & EV,Industrial & Investment,4.95,0.0,2025-05-12
2025-03-18,Pemerintah Proyeksi Investasi Proyek Hilirisasi Batu Bara Tembus Rp522 Triliun,IMPACT,Coal & Energy,Industrial & Investment,4.11,0.0,2025-03-17
2025-06-05,Bahlil Ungkap Ada 5 Izin Tambang Nikel di Raja Ampat Papua,EXECUTION,Nickel & EV,Mining & Upstream,4.88,0.0,2025-06-02
2025-08-27,"Smelter Gangguan, Freeport Tunggu Evaluasi ESDM soal Ekspor Konsentrat",EXECUTION,Other Minerals,Industrial & Investment,4.9,0.0,2025-08-25
2026-01-26,"Bos Danantara Bocorkan Rencana Belanja Investasi Proyek 2026, Capai Rp235 Triliun",DISCOURSE,General,Industrial & Investment,4.65,0.0,2026-01-26
2025-03-04,"Kala Kantong Laba Emiten Batu Bara ITMG, BYAN, ADMR Mengempis",DISCOURSE,Coal & Energy,General,3.0,0.0,2025-03-03
2025-11-20,BKPM Pamer Dampak Hilirisasi Nikel: Ekonomi Daerah Tumbuh hingga Pengangguran Turun,EXECUTION,Nickel & EV,Industrial & Investment,4.88,0.0,2025-11-17
2025-09-09,"Joint Venture Chile-China Bangun Pabrik Grinding Ball di Batang, Beroperasi Akhir 2025",EXECUTION,Nickel & EV,Industrial & Investment,5.0,0.0,2025-09-08
2025-07-21,"Capex Tebal ANTM, PTBA, INCO Cs, Emiten MIND ID Siap Tancap Gas?",POLICY,Nickel & EV,Industrial & Investment,4.26,0.0,2025-07-21
2024-06-04,Aturan Baru! Kemendag Relaksasi Ekspor Konsentrat Tembaga Cs.,POLICY,Other Minerals,Trade & Export,5.0,0.0,2024-06-03
2025-10-28,"Smelter Amman Setop Operasi Sejak Juli, Berharap Boleh Ekspor Konsentrat",EXECUTION,Other Minerals,Trade & Export,4.97,0.0,2025-10-27
2024-12-11,"Akselerasi Hilirisasi, Menteri Rosan Akan Angkat Pegawai Penata Penanaman Modal di BKPM",POLICY,General,Industrial & Investment,4.24,0.0,2024-12-09
2025-12-08,Industri Kecantikan Diproyeksikan Terus Tumbuh pada 2026,DISCOURSE,General,Industrial & Investment,3.0,0.0,2025-12-08
2025-06-12,Kapolri Sigit: Bareskrim Cari Unsur Pidana di Kasus Tambang Nikel Raja Ampat,DISCOURSE,Nickel & EV,Mining & Upstream,3.0,0.0,2025-06-09
2024-11-18,Prabowo Ajak Pengusaha Brasil Investasi di 26 Komoditas Hilirisasi RI,DISCOURSE,General,Industrial & Investment,3.2,0.0,2024-11-18
2025-11-06,Danantara Pastikan 18 Proyek Hilirisasi Senilai Rp600 Triliun Siap Jalan 2026,DISCOURSE,Other Minerals,Industrial & Investment,3.2,0.0,2025-11-03
2025-11-10,"Toyota Tsusho Siapkan Rp1,6 Triliun, Investasi Bahan Baku Kabel di RI",DISCOURSE,Other Minerals,Industrial & Investment,3.0,0.0,2025-11-10
2025-04-24,"PAM Mineral Pacu Produksi Nikel, Siap Rampungkan Akuisisi",DISCOURSE,Nickel & EV,Mining & Upstream,4.13,0.0,2025-04-21
2025-12-20,API Ingatkan Ancaman PHK Massal jika PP Pengupahan Baru Tak Diawasi,POLICY,General,Trade & Export,4.27,0.0,2025-12-15
2026-01-12,Investasi Properti Komersial Bertahan di Tengah Lesunya Pasar Hunian,DISCOURSE,General,Industrial & Investment,3.24,0.0,2026-01-12
2025-10-01,Harga Batu Bara Acuan (HBA) 1 Oktober 2025: Semua Jenis Kompak Naik,IMPACT,Other Minerals,Mining & Upstream,4.98,0.0,2025-09-29
2025-05-28,Danantara & Eramet Kerja Sama Investasi Pengembangan Bahan Baku Baterai,DISCOURSE,Nickel & EV,Industrial & Investment,3.0,0.0,2025-05-26
2025-09-15,ESDM Ungkap Alasan Izinkan Tambang Gag Nikel Beroperasi Kembali,EXECUTION,Nickel & EV,Mining & Upstream,5.0,0.0,2025-09-15
2025-07-01,"Pemprov Jabar Tutup 118 Tambang Ilegal, 58 Lokasi Tengah Diproses",DISCOURSE,Other Minerals,Mining & Upstream,3.0,0.0,2025-06-30
2025-12-01,"RI Impor Beras Rp2,97 Triliun, Kementan: Itu Beras Khusus & Industri",DISCOURSE,General,Trade & Export,3.0,0.0,2025-12-01
2025-01-09,MIND ID Gali Potensi Pengembangan Hilirisasi Batu Bara jadi Polisilikon,DISCOURSE,Other Minerals,Industrial & Investment,3.0,0.0,2025-01-06
2026-01-15,"RKAB Vale (INCO) Disetujui ESDM, Perusahaan Fokus Pulihkan Operasi",DISCOURSE,Nickel & EV,Mining & Upstream,3.2,0.0,2026-01-12
2025-01-06,"MIND ID Investasi Rp20,6 Triliun untuk 5 Proyek Strategis Tahun Ini",EXECUTION,Nickel & EV,Industrial & Investment,4.92,0.0,2025-01-06
2025-11-02,"Anak Usaha Sumber Global Energy (SGER), SMGA Ekspansi Bisnis Smelter Nikel",EXECUTION,Nickel & EV,Industrial & Investment,4.88,0.0,2025-10-27
2025-06-09,Menghitung Ongkos Besar Kerusakan Lingkungan dari Tambang Nikel di Raja Ampat,POLICY,Nickel & EV,Sustainability & ESG,1.44,-2.5,2025-06-09
2025-06-10,Deretan Penikmat Nikel Raja Ampat: dari Antam hingga Keluarga Aguan,EXECUTION,Nickel & EV,Mining & Upstream,5.0,0.0,2025-06-09
2025-12-30,Holding Tambang MIND ID Dinilai Sukses dalam Transformasi Bisnis Pertambangan,EXECUTION,Nickel & EV,Industrial & Investment,4.88,0.0,2025-12-29
2025-07-18,"Vale Indonesia (INCO) Bidik Pendanaan Jumbo Rp19,56 Triliun",DISCOURSE,Nickel & EV,Industrial & Investment,3.2,0.0,2025-07-14
2025-06-09,Mengapa Ada Tambang Nikel di Kawasan Raja Ampat? Ini Asal Usulnya,DISCOURSE,Nickel & EV,Mining & Upstream,3.0,0.0,2025-06-09
2025-12-01,"PMI Manufaktur Ekspansif, Airlangga Pede Industri Melaju Tahun Depan",DISCOURSE,Nickel & EV,Industrial & Investment,3.0,0.0,2025-12-01
2025-10-12,Perhapi Minta Pemerintah Lebih Selektif Beri Izin Usai 190 Tambang Dibekukan,EXECUTION,Other Minerals,Mining & Upstream,1.0,-12.5,2025-10-06
2025-10-21,Harga Logam Dasar Kian Solid Jelang Perundingan Dagang AS-China,DISCOURSE,Other Minerals,Trade & Export,3.24,0.0,2025-10-20
2026-01-13,"Danantara Kumpulkan Bos Antam dan IBC, Bahas Proyek Hilirisasi",EXECUTION,Nickel & EV,Industrial & Investment,4.81,0.0,2026-01-12
2025-10-12,Dua Korban Kebakaran Menara Scrubber Pabrik Nikel di IMIP Sudah Diizinkan Pulang,DISCOURSE,Nickel & EV,Industrial & Investment,3.0,0.0,2025-10-06
2025-12-18,"Mekanisme Perdagangan Karbon Sektor Industri Disiapkan, Proyek Pilot Bergulir 2026",POLICY,General,Sustainability & ESG,4.91,0.0,2025-12-15
2025-12-08,CIMB Finance (CNAF) Buka-bukaan Efek Buruk Jual-Beli Kendaraan STNK Only,DISCOURSE,General,General,3.0,0.0,2025-12-08
2025-03-04,Bos Danantara Pastikan Investasi Proyek Hilirisasi Lewat Seleksi Ketat,DISCOURSE,General,Industrial & Investment,3.0,0.0,2025-03-03
2025-12-07,Kiat Industri Asuransi Umum Tekan Rasio Klaim Lini Kesehatan,DISCOURSE,General,General,3.0,0.0,2025-12-01
2025-06-10,Daftar 4 Izin Tambang Nikel di Raja Ampat yang Dicabut,DISCOURSE,Nickel & EV,Mining & Upstream,1.09,-2.5,2025-06-09
2025-12-30,"Hilirisasi Jadi Andalan, Dharma Jaya Perluas Bisnis Sapi",DISCOURSE,General,Industrial & Investment,3.86,0.0,2025-12-29
2026-01-13,Produksi Smelter Terganggu Imbas Persetujuan RKAB Tambang Molor,EXECUTION,Other Minerals,Industrial & Investment,4.9,0.0,2026-01-12
2024-09-12,"Soal Jatah Tambang Muhammadiyah, Bahlil: Kita Kasih Terbaik Bos",DISCOURSE,Other Minerals,Mining & Upstream,3.0,0.0,2024-09-09
2026-01-27,"Laba Industri China Berbalik Tumbuh pada 2025, Tekanan Deflasi Mulai Mereda",DISCOURSE,Other Minerals,Industrial & Investment,3.0,0.0,2026-01-26
2025-09-23,"IEU-CEPA Resmi Ditandatangani, Ekspor Uni Eropa ke Indonesia Siap Melesat",POLICY,Nickel & EV,Trade & Export,4.27,0.0,2025-09-22
2025-06-10,"Tak Dicabut, Pemerintah Awasi Ketat Pemulihan Lingkungan Gag Nikel di Raja Ampat",POLICY,Nickel & EV,Sustainability & ESG,4.38,0.0,2025-06-09
2025-06-08,Segini Anggaran Kementerian Bahlil yang Urus Polemik Tambang Nikel Raja Ampat,EXECUTION,Nickel & EV,Mining & Upstream,4.88,0.0,2025-06-02
2025-04-17,MIND ID Ajak BUMN Arab Saudi Bangun Smelter Alumina & Aluminium,DISCOURSE,Other Minerals,Industrial & Investment,3.0,0.0,2025-04-14
2025-08-15,Prabowo Klaim Danantara Akan Ciptakan Jutaan Lapangan Kerja di Bidang Hilirisasi,DISCOURSE,General,Industrial & Investment,3.0,0.0,2025-08-11
2025-07-18,"Nego Masih Lanjut, RI Minta CPO hingga Nikel Dapat Tarif 0% ke AS",DISCOURSE,Nickel & EV,Trade & Export,3.0,0.0,2025-07-14
2025-12-10,Putin Tawarkan Bantuan untuk Bangun Pembangkit Nuklir di RI,DISCOURSE,Coal & Energy,General,3.2,0.0,2025-12-08
2025-07-30,"Smelter Nikel Bertumbangan, Investasi Hilirisasi Terancam?",DISCOURSE,Nickel & EV,Industrial & Investment,1.38,-1.5,2025-07-28
2025-11-14,"Investasi Pabrik CCO, Sekda Banyuasin Sebut Operasional Ditarget 2027",IMPACT,General,Industrial & Investment,4.99,0.0,2025-11-10
2026-01-21,"Izin Impor Skrap Tertunda, Produksi Industri Aluminium Terganggu",DISCOURSE,General,Trade & Export,3.0,0.0,2026-01-19
2025-07-03,"RKAB Minerba Kembali per 1 Tahun, Penambang Nikel Soroti Efektivitas",IMPACT,Other Minerals,Mining & Upstream,4.6,0.0,2025-06-30
2025-12-10,Daftar Besaran Denda Tambang Ilegal di Kawasan Hutan,IMPACT,Other Minerals,Mining & Upstream,5.0,0.0,2025-12-08
2025-03-06,"Rosan: Danantara Bakal Hati-hati Investasi, Hilirisasi Prioritas Utama",DISCOURSE,General,Industrial & Investment,3.2,0.0,2025-03-03
2025-10-16,"Momentum Harga Tembaga Tinggi, Pemerintah Perlu Genjot Industri Hilir",IMPACT,Other Minerals,Industrial & Investment,5.0,0.0,2025-10-13
2025-08-26,Eramet Dapat Restu Produksi 42 Juta Ton Nikel di Weda Bay Tahun Ini,DISCOURSE,Nickel & EV,Mining & Upstream,3.65,0.0,2025-08-25
2026-01-22,"Pemprov Riau Tetapkan 30 Blok Pertambangan Rakyat di Kuansing, Ini Luasnya",POLICY,Other Minerals,Sustainability & ESG,4.94,0.0,2026-01-19
2025-11-28,OJK: Nasabah Beralih dari Unit-Linked ke Produk Tradisional Pengaruhi Turunnya Premi Asuransi,DISCOURSE,General,Industrial & Investment,3.0,0.0,2025-11-24
2025-02-03,Indef Buka-bukaan Potensi Cuan Jumbo dari Hilirisasi Tembaga RI,IMPACT,Other Minerals,Industrial & Investment,4.11,0.0,2025-02-03
2025-05-16,Profil Chris McCleave Anggota Komisaris Baru Vale Indonesia (INCO),DISCOURSE,General,Industrial & Investment,3.0,0.0,2025-05-12
